Constituency,DistrictEnglish,DistrictNepali,CandidateEnglish,CandidateNepali,Source,Title,URL,Snippet,Content,RelevanceScore,ScrapedAt
2,bhaktapur,भक्तपुर,Rajesh Bade,राजेश बाडे,DDG (en2),Rajesh Bade - Nepal Election 2082 - Latest Election Updates And Results ...,https://election.ekantipur.com/profile/1616?lng=eng,"Profile ofRajeshBadeincluding age 38, party affiliation,constituencyBhaktapur-2 andNepalElection2082results.","Profile ofRajeshBadeincluding age 38, party affiliation,constituencyBhaktapur-2 andNepalElection2082results.",22.0,2026-03-05T15:07:06.549989
2,bhaktapur,भक्तपुर,Rajesh Bade,राजेश बाडे,Nepali Times,Nepalis Select Who To Elect,https://www.nepalitimes.com/news/nepalis-select-who-to-elect,,"Nepalis Select Who To Elect It is a partial poll when a quarter of the eligible electorate cannot vote? 27 February 2026 Sonia Awale 0 Photo: NT ARCHIVES Of the nearly 19 million eligible voters in next week’s election in Nepal, an estimated 5 million are abroad and cannot cast their ballots. Many others within Nepal must travel to their home districts, and might decide not to because of the cost. Flights into Kathmandu these days are full of global Nepalis returning just to vote, but almost as many are leaving for overseas jobs. Most of those coming or going are in the 20-40 age group, and a majority want Nepal to see a change in leadership. Bangladesh held an election this month in which citizens overseas could vote by mail. “Bangladesh made maximum use of technology not just for campaigning but also for polling itself. We could have also managed this, so people within Nepal did not have to travel to their home districts to vote,” says Mohna Ansari, former head of Nepal’s National Human Rights Commission who was an election observer in Bangladesh. A 3-day holiday has been declared so people can travel to their home constituencies to cast ballots. Even if there was not enough time to manage ballots for overseas Nepalis, it could have been done for Nepalis within Nepal. Former Chief Election Commissioner Bhojraj Pokharel reckons that physical voting in countries with a large Nepali diaspora would have been a logistical nightmare, but in the PR system, using electronic voting machines or paper ballot could have been piloted in some places. It is not possible to manage the entire voting process until we introduce the internet voting system. “First of all, there needs to be political will to bring the policy and be ready to undertake that level of investment and it is not a one-time cost,” Pokharel says. “A government formed by the GenZ could have atr least issed an ordinance ensuring this right, piloted out-of-country voting where possible, which could have built pressure for the future Parliament and the government. It would have given people hope. It is a lost opportunity.” All major political parties called for voting rights for global Nepalis in their manifestos, but these very leaders blocked legislation allowing it despite a 2017 Supreme Court ruling out of fear that it would be anti-incumbent. Why so late? Bangladesh delivered election results in just one day, but the final results of Nepal's last local polls in 2022 including that of Kathmandu constituencies took nearly a month. Acting Chief Election Commissioner Ram Prasad Bhandari said this week that the results of the First-Past-The-Post (FPTP) ballot counting would “likely” be published within 24 hours of the poll closing at 5PM on 5 March. But many are skeptical. “I wonder if we lack the capacity or know-how to announce results as quickly as possible,” says Mohna Ansari. Former Chief Election Commissioner Pokharel says manual ballot paper counting in Nepal is inherently slow because of the large numner of political parties and/or candidates on the ballot, the counting mechanism, the political behaviour of the candidates/parties and some managerial issues during counting. “Our present policy is to count all the ballot papers at the returning officers' officies, located at the district headquarters. It requires collecting ballot boxes safetly first. This takes time, and there have been cases of ballot boxes being damaged or stolen during transport. In a few highly difficult, geographically remote polling centres, we use a helicopter or transport. But sometimes, accommodating the party and candidates' representatives remains challenging,” explains Pokharel. A solution could be counting ballots at the very booths where they are cast. Another reason for the delay is simply the number of political parties, and the need for each ballot paper to be examined by booth representatives for consensus. In close races, the smallest difference can lead to tense situations, further delaying results, even though counting centres are protected by metal fencing so there is no disruption. After this, then it is the turn of Proportional Representation (PR) ballots to be counted. Weeks pass by the time the results of candidates and parties are tallied and verified. But the most common delay is because election officers think ballot counting is a nine-to-five job. “The efficiency of poll station officers is most important, and they are incentivised for this,” says Ansari, adding that counting can even start within an hour after voting closes. In remote areas, local resources could be mobilised to make counting quicker, but there is a crisis of trust, adds Ansari. That could be easily solved with electronic voting which the EC implemented in the 2008 polls but discontinued because political parties felt the machines could be hacked or manipulated. Sonia Awale writer Sonia Awale is the Editor of Nepali Times where she also serves as the health, science and environment cor",7.2,2026-03-05T15:07:06.550002
2,bhaktapur,भक्तपुर,Rajesh Bade,राजेश बाडे,DDG (en2),Bhaktapur Constituency 2 - House of Representatives Election 2082 ...,https://election.nepsebajar.com/en/pratinidhi/50/bhaktapur-2-election-result-live-election-2082,"Liveelectionresults forBhaktapurConstituencyNo.2in theNepalFederal Parliament (House of Representatives)Election2082. View vote counts, candidate details, andconstituencyanalysis. The voter age breakdown includes: 6,908 (18-25), 30,899 (26-40), 40,230 (41-60), and 20,311 (61+).","Liveelectionresults forBhaktapurConstituencyNo.2in theNepalFederal Parliament (House of Representatives)Election2082. View vote counts, candidate details, andconstituencyanalysis. The voter age breakdown includes: 6,908 (18-25), 30,899 (26-40), 40,230 (41-60), and 20,311 (61+).",6.6,2026-03-05T15:07:06.550004
2,bhaktapur,भक्तपुर,Rajesh Bade,राजेश बाडे,DDG (en2),Nepal Election 2082 - Live Results & Candidate Tracker,https://2082.live/,"TrackNepal's2082FederalElectionlive results with real-time vote counting, interactiveconstituencymaps, and comprehensive candidate analytics.","TrackNepal's2082FederalElectionlive results with real-time vote counting, interactiveconstituencymaps, and comprehensive candidate analytics.",5.1,2026-03-05T15:07:06.550005
2,bhaktapur,भक्तपुर,Rajesh Bade,राजेश बाडे,DDG (en2),"भक्तपुर - २ | Nepal Election 2082 | Candidates, Constituencies ...",https://election.ratopati.com/constituency/bhaktapur-2,"Get the latestNepalElection2082updates on Ratopati. Search for candidates byconstituency, track political party performance, and see real-time voter statistics. Follow the2082federalelectionresults live here!","Get the latestNepalElection2082updates on Ratopati. Search for candidates byconstituency, track political party performance, and see real-time voter statistics. Follow the2082federalelectionresults live here!",5.1,2026-03-05T15:07:06.550007
2,bhaktapur,भक्तपुर,Rajesh Bade,राजेश बाडे,Ratopati,कांग्रेस नेता डा.कोइरालाद्वारा मतदान,https://www.ratopati.com/story/548169/congress-leader-dr-koirala-casts-his-vote,,"कांग्रेस नेता डा.कोइरालाद्वारा मतदान रासस बिहीबार, २१ फागुन २०८२, १२ : ११ फाइल तस्बिर रासस बिहीबार, २१ फागुन २०८२ मोरङ ।  नेपाली कांग्रेसका डा.शेखर कोइरालाले विराटनगर महानगरपालिका–७ स्थित आदर्श माविमा रहेको मतदान केन्द्रबाट मतदान गरेका छन् । मोरङ क्षेत्र नं ६ का उम्मेदवारसमेत रहनुभएका डा शेखर कोइरालाले मतदानपछि पत्रकारसँग संक्षिप्त कुराकानी गर्दै सबैको आपसी सहकार्य र समन्वयबाट मुलुक निर्माणमा लाग्नुपर्ने धारणा राखे । डा.शेखर कोइराला खबर पढेर तपाईलाई कस्तो महसुस भयो ? प्रतिक्रिया लेखकको बारेमा रासस राष्ट्रिय समाचार समिति नेपालकाे  सरकारी समाचार संस्था हाे । लेखकबाट थप भर्खरै परिवर्तनको आशा बोकेर मतदान हुम्लाको हल्जीमा गुम्बामा मतपेटिका पुर्‍याउन माग गरेपछि विवाद रुपन्देहीमा ५० प्रतिशत मत खस्यो रञ्जु दर्शनाले गरिन् मतदान भारत-इङ्ल्यान्ड सेमिफाइनल : मौसम अनुकूल हुँदा वानखेडेमा बन्न सक्छ उच्च स्कोर पर्साको चार वटा निर्वाचन क्षेत्रमा कहाँ कति मत खस्यो ? ट्रेन्डिङ १. मतदान केन्द्रमा खटिएका कर्मचारी नै पक्राउ परेपछि... २. गन्तव्यमा नपुगी किन फर्कियो बालेन सवार हेलिकप्टर ? ३. बालेन चढेको हेलिकप्टर झापामा ल्यान्ड गरेन, काठमाडौँ फर्कँदै ४. श्रीलंका नजिकै इरानी युद्धपोतमा अमेरिकी आक्रमण, ८० नौसैनिकको मृत्यु ५. बुटवलमा पैसा बाँडेको आरोपमा एमाले र रास्वपाका कार्यकर्ताबिच झडप ६. कर्मचारीमाथि हातपात गर्न खोजेपछि दोलखामा हवाई फायर ७. चुनावमा खटिएका १२ जना सुरक्षाकर्मी र दुई मतदान अधिकृतको मृत्यु ८. राष्ट्रिय सुरक्षा परिषद्को बैठकले के गर्‍याे निर्णय ? छुटाउनुभयो कि ? निर्वाचन बहिष्कार गर्दै आन्दोलनको घोषणा प्रतिनिधि सभा उम्मेदवारले नै पार्टी छाडेपछि... प्रतिनिधि सभा उम्मेदवार पौडेलले फिर्ता लिए उम्मेदवारी रास्वपा र एमालेका कार्यकर्ताबिच झडप, २ जना घाइते धादिङमा बस दुर्घटना: १७ जनाको मृत्यु, २४ घाइते गौर झडप : ३ गाडी र दुई मोटरसाइकलमा आगजनी धादिङ बस दुर्घटनाः मृत्यु भएका १९ मध्ये ९ जनाको सनाखत (नामावलीसहित) बालेनलाई कारबाहीसहित नागरिकता रद्दको माग गर्दै गृह मन्त्रालयमा उजुरी",5.1,2026-03-05T15:07:06.550008
2,bhaktapur,भक्तपुर,Rajesh Bade,राजेश बाडे,DDG (en2),Bhaktapur-2 | Nepal Parliament Election 2082 Results and Updates,https://nepalelectionupdates.com/district/bhaktapur/2,View all candidates andelectionresults forBhaktapurConstituency2inNepalParliamentElection2082.,View all candidates andelectionresults forBhaktapurConstituency2inNepalParliamentElection2082.,4.8,2026-03-05T15:07:06.550010
2,bhaktapur,भक्तपुर,Rajesh Bade,राजेश बाडे,Ratopati,मोरङमा दिउँसो २ बजेसम्म ३२ प्रतिशत मत खस्यो,https://www.ratopati.com/story/548241/32-percent-voter-turnout-in-morang-by-2-pm,,"मोरङमा दिउँसो २ बजेसम्म ३२ प्रतिशत मत खस्यो रातोपाटी संवाददाता बिहीबार, २१ फागुन २०८२, १४ : ५४ रातोपाटी संवाददाता बिहीबार, २१ फागुन २०८२ मोरङ । प्रतिनिधि सभा निर्वाचनअन्तर्गत मोरङमा दिउँसो २ बजेसम्म कुल ३२ प्रतिशत मत खसेको छ । जिल्ला प्रशासन कार्यालय मोरङले सार्वजनिक गरेको २ बजेसम्मको विवरण अनुसार, यस अवधिसम्म २ लाख ९२ हजार ४ सय २५ मत खसेको हो । जिल्लाभरिका ८८८ वटा मतदान केन्द्रहरूमा ७ लाख ८३ हजार ४० कुल मतदाता रहेका छन् । मोरङ मतदान खबर पढेर तपाईलाई कस्तो महसुस भयो ? प्रतिक्रिया लेखकको बारेमा रातोपाटी संवाददाता ‘सबैको, सबैभन्दा राम्रो’ रातोपाटी डटकम। लेखकबाट थप भर्खरै परिवर्तनको आशा बोकेर मतदान हुम्लाको हल्जीमा गुम्बामा मतपेटिका पुर्‍याउन माग गरेपछि विवाद रुपन्देहीमा ५० प्रतिशत मत खस्यो रञ्जु दर्शनाले गरिन् मतदान भारत-इङ्ल्यान्ड सेमिफाइनल : मौसम अनुकूल हुँदा वानखेडेमा बन्न सक्छ उच्च स्कोर पर्साको चार वटा निर्वाचन क्षेत्रमा कहाँ कति मत खस्यो ? ट्रेन्डिङ १. मतदान केन्द्रमा खटिएका कर्मचारी नै पक्राउ परेपछि... २. गन्तव्यमा नपुगी किन फर्कियो बालेन सवार हेलिकप्टर ? ३. बालेन चढेको हेलिकप्टर झापामा ल्यान्ड गरेन, काठमाडौँ फर्कँदै ४. श्रीलंका नजिकै इरानी युद्धपोतमा अमेरिकी आक्रमण, ८० नौसैनिकको मृत्यु ५. बुटवलमा पैसा बाँडेको आरोपमा एमाले र रास्वपाका कार्यकर्ताबिच झडप ६. कर्मचारीमाथि हातपात गर्न खोजेपछि दोलखामा हवाई फायर ७. चुनावमा खटिएका १२ जना सुरक्षाकर्मी र दुई मतदान अधिकृतको मृत्यु ८. राष्ट्रिय सुरक्षा परिषद्को बैठकले के गर्‍याे निर्णय ? छुटाउनुभयो कि ? निर्वाचन बहिष्कार गर्दै आन्दोलनको घोषणा प्रतिनिधि सभा उम्मेदवारले नै पार्टी छाडेपछि... प्रतिनिधि सभा उम्मेदवार पौडेलले फिर्ता लिए उम्मेदवारी रास्वपा र एमालेका कार्यकर्ताबिच झडप, २ जना घाइते धादिङमा बस दुर्घटना: १७ जनाको मृत्यु, २४ घाइते गौर झडप : ३ गाडी र दुई मोटरसाइकलमा आगजनी धादिङ बस दुर्घटनाः मृत्यु भएका १९ मध्ये ९ जनाको सनाखत (नामावलीसहित) बालेनलाई कारबाहीसहित नागरिकता रद्दको माग गर्दै गृह मन्त्रालयमा उजुरी",4.5,2026-03-05T15:07:06.550011
