Constituency,DistrictEnglish,DistrictNepali,CandidateEnglish,CandidateNepali,Source,Title,URL,Snippet,Content,RelevanceScore,ScrapedAt
2,bhaktapur,भक्तपुर,Rajesh Bade,राजेश बाडे,Reddit/r/NepalSocial,[r/NepalSocial] Rajesh Hamal's video post today,https://www.reddit.com/r/NepalSocial/comments/1rkuh5j/rajesh_hamals_video_post_today/,↑2  💬2,"First I request you to watch the video to the end. He first talks about past few and current conflicts in the world, then genz revolution and what if there comes instability. So think before vote.

OFC we should think before voting. But bringing up fear, now, does not help either.

I genuinely believe his post is slightly biased towards old political parties. It's equivalent to queen's post just before the Brexit election UK. Of course he is nowhere near queen in stature but he is respected figure in our country.

I don't understand why ""bideshi chalkhel + bhurajnitic issues"" happens if someone new wins the election. Aren't they nepali? Aren't they in nepal and dreaming about making it a better place. Why is someone like his status would bring this up just before the election.

What do you think?

Thanks for making a submission. Please use an appropriate flair for better reach and response. In case of a NSFW post, tag it as NSFW and use ""sax sux” flair if it applies. Otherwise, the post will be removed.

*I am a bot, and this action was performed automatically. Please [contact the moderators of this subreddit](/message/compose/?to=/r/NepalSocial) if you have any questions or concerns.*
---
I amnot going to label anyone anything but people love conspiracies. It is always easier to label issues we are having to someone else. Instead of trying to unite us, these statements only creates divison. I am not saying external power is not acting because it can be seen from the time of Tribhuwan, then Prachanda and so on. But everything was so easy because we can be divided easily. Now too, we are being divided easily. It is evident that this is new vs old this time. If external forces can interfer so easily then surely none of the older parties were strong enough to stop that. I do not support autocracy but each day passes and I start to admire Mahendra more for dissolving multi party system. There was Madan Bhandari challenging King that time, and we have Balen challenging King alike this time. I label both as populist but this is what the society wants.",3.0,2026-03-05T15:07:06.550017
2,bhaktapur,भक्तपुर,Rajesh Bade,राजेश बाडे,Nepali Times,Who is accountable for teacher-student relationships?,https://www.nepalitimes.com/here-now/who-is-accountable-for-teacher-student-relationships,,"Who is accountable for teacher-student relationships? “I was groomed, then I was sued for defamation,” says university alumna about a faculty member 26 February 2026 Subeksha Poudel 0 As a new student at Kathmandu University's Bachelor’s in Fine Arts in 2014, Mukta, 25 then, thought she must be doing something good when her teacher singled her out for attention. Her teacher was Sujan Chitrakar, then 40, the senior-most faculty, and a celebrated artist. Chitrakar has taught many contemporary Nepali artists and played an important role in establishing what is now KU’s Department of Art and Design (pictured). In between messages to Mukta about schoolwork, he texted to say he missed her or that she looked beautiful. She recalls being taken aback by a particular text that said: ‘I’m going for a bath. Do you want to see me?’ This was immediately followed with a cartoonish drawing with ‘Nude’ written next to it. Mukta awkwardly replied with a laugh, unsure how else to respond to such a message from her teacher, whom everyone placed on a pedestal. During Mukta’s first year in school, she says Chitrakar continued to shower her with gifts, asked her out for coffee, and insisted on driving her around. Once, when she was on his motorcycle returning home from university, Mukta remembers Chitrakar asking her to kiss him on his shoulder. When she refused, he apologised profusely, then asked if she was trying to seduce him. Seeing how shocked Mukta was, the teacher grabbed her hand and rubbed it against his chest, saying it was just a joke. A few weeks later, Chitrakar told Mukta that he couldn’t live without her and that they should be in a relationship. Having only looked up to him as a teacher, Mukta was uncertain about her feelings. When the earthquake struck in 2015, Chitrakar came to check on Mukta, and with her guards down, she felt perhaps his love was genuine. She didn’t doubt if she was safe with him. A decade later, still reeling from psychological trauma and career setbacks because of the relationship, Mukta is breaking her silence, accusing Chitrakar of abusing his power and grooming her. He had the duty of teaching and evaluating her, instead, Mukta says he used her for sex and emotional support from 2015 to 2019, while she was a student at KU. DEFAMATION SUIT She has been urging KU and art institutions to safeguard its students against sexual misconduct, but Chitrakar slammed a defamation lawsuit against her in January 2025 stating she damaged his reputation over what he described in court filings as a ""consensual relationship”. Earlier this week, the Kathmandu District court ruled that Chitrakar’s defamation claim could not be proven. We asked Chitrakar after the verdict about his conduct. His reply: “I’m sorry for the students who felt uncomfortable, but I did my duty well and good. It is ungrateful of the students to say that. Not everyone has to like me.” In answer to a query about his stance on intimate relationship between staff and student, he said: “For me it is a big no to date a student. Consequences arise and I am facing them now. Many staff-student intimate relations, including in my department, have ended in happy marriages. It’s a choice based on their personal and social ethics, and something to be determined by university policy.” Chitrakar said he now draws personal and professional boundaries with students, and says his relationship was not planned. He added, “Regardless of being a teacher I should not have dated a student because I'm a married man. If I was unmarried it would have been ok. While there is no definitive data on sexual misconduct in Nepal, interviews with more than 23 faculty and students from KU and TU for this story reveal that intimate staff-student relations are normalised, and in some cases even encouraged. Studies also suggest that sexual harassment is rampant in higher education in Nepal. The lack of university policies, power imbalance between staff and students, fear of retaliation, breaches of confidentiality, and the protection of perpetrators all contribute to impunity for sexual misconduct. Indeed, after students alleged sexual harassment, bullying, and homophobia against Yubaraj Sangroula of Kathmandu School of Law, and other faculty members in March 2025, the university filed slander lawsuits targeting a student whistleblower and alumni. Sangroula is contesting as an independent candidate in next week’s election from Jhapa-2. Seven years after complaints surfaced against retired lecturer Krishna Bhattachan for sexually harassing women students , Tribhuvan University, the government run institution, is still drafting its own policy and complaint procedure. And noted sculptor and former KU faculty member Gopal Kalapremi is yet to appear at Kathmandu District Court, after he was issued a summon on sexual harassment charges in 2024. Nepal’s Sexual Harassment at Workplace (Prevention) Act (2014) and the National Criminal (Code) Act, 2017 both forbid sexual relations",3.0,2026-03-05T15:07:06.550019
2,bhaktapur,भक्तपुर,Rajesh Bade,राजेश बाडे,Nepali Times,West Asia war and Nepalis,https://www.nepalitimes.com/news/west-asia-war-and-nepalis,,"West Asia war and Nepalis Two million Nepalis live and work in the Gulf region that is the mainstay of country’s economy through remittances 28 February 2026 Nepali Times 0 Passengers at Kathmandu airport waiting for flights on Saturday evening. On Saturday, Iran retaliated with missile strikes on Abu Dhabi, Dubai, Bahrain and Qatar, a region where there are an estimated 2 million Nepalis working to send money home. In addition, thousands of Nepalis were preparing to board flights to Kathmandu from West Asian cities this weekend to vote in the 5 March election. Many are said to be stranded at various aviation hubs. A Qatar Airways flight from Doha took off just before the air space was closed, while Air Arabia and Kuwait Airways have diverted or cancelled flights. Nepalis in the West Asian region said things were relatively calm where they were, although some heard loud explosions at about noon local time. In Dubai, some thought they were Ramadan fireworks. In Kuwait, nearly 2,000 Nepalis working in the US military base as security guards and cleaners were evacuated before the strikes. In Bahrain where the US Fifth Fleet naval base is located and which was hit by two Iranian missiles, workers contacted by Nepali Times said the situation was under control and the authorities had told everyone to stay indoors and not use highways. The conflict also coincided with the beginning of Nepal’s trekking and mountaineering season, and tourists were either on their way or planning to leave European and North American cities for Himalayan hikes. Most of them transit through Doha, Dubai or Kuwait and all three airports are closed. Turkish Airlines flights via Istanbul are still operating. Qatar and UAE airspace closed. Credit: Flightradar24 However, the main impact for the world could be a spike in the price of petroleum products if the strategic Strait of Hormuz is blocked. China relies on Iranian oil for their refineries, and Nepal could be affected indirectly if the economies of its neighbours are hit. Nepal imports all its diesel, petrol, LPG and aviation fuel from India which sources it mainly from the Gulf, and until recently from Russia. Petroleum makes up 25% of the value of all imports, and that is more than Nepal earns from all its exports. Saudi Arabia this year overtook the UAE as the main destination for Nepali workers, with the number now totalling 400,000. There are said to be as many in the UAE, and another 350,000 in Qatar. There are another 100,000 mostly women in Kuwait, and 50,000 each in Oman and Bahrain. Iran retaliated with missile strikes on Abu Dhabi, Dubai, Bahrain and Qatar on Saturday. Nepal receives nearly $11 billion a year in remittances from overseas Nepalis (not counting India) through official channels, although the total is said to be much more.  This makes up more than a quarter of Nepal’s GDP equivalent — one of the highest proportions in the world. More than half of the overseas remittances to Nepal comes from its workers in the Gulf, and it is the mainstay of the country’s economy. Nepalis in Saudi Arabia, Qatar and the UAE alone send home more than $3 billion a year, much of that helping support their families back home. An average Nepali worker in the Gulf sends home nearly $2,500 a year, and this is spent mainly for household supplies, children’s education and healthcare. There are also an estimated 7,000 Nepali caregivers and healthcare workers in Israel, and most of them are women. The Nepal Embassy has asked Nepalis in Israel to take caution and move to bomb shelters. Tags overseas Nepalis West Asia conflict Gulf countries",2.7,2026-03-05T15:07:06.550020
2,bhaktapur,भक्तपुर,Rajesh Bade,राजेश बाडे,Nepali Times,International commentary on Nepal election,https://www.nepalitimes.com/news/international-commentary-on-nepal-election,,"International commentary on Nepal election Selection of readings from the foreign press about Nepal election 03 March 2026 0 The BBC documentary Shot Like Enemies: Inside Nepal’s GenZ Uprising set off a frenzied debate in the public sphere, highlighting how sensitive international coverage of the country still is for Nepalis despite the national media doing its job. The investigative report focussed on the massacre outside Parliament on 8 September that led to the collapse of the government and paved the way for the election on Thursday. There was praise from supporters of the film and scathing criticism. Raw clips and leaked conversations showed how deliberately the protesters were shot in cold blood. Others saw a sinister conspiracy behind the release of what they regarded as a one-sided documentary just a week before the election. News in the foreign media of the election from Nepal was eclipsed this week by the war in West Asia. Nepali Times brings this selection of readings from the international press. For the complete articles go online or type in the links. Read the full story here. Read the full story here. Read the full story here. Read the full story here. Read the full story here. Read the full story here. Tags Al Jazeera BBC Nepal elections Balen Shah RSP Gen Z protests Scroll In THe Hindu Atlantic Council",2.7,2026-03-05T15:07:06.550021
2,bhaktapur,भक्तपुर,Rajesh Bade,राजेश बाडे,Reddit/r/NepalSocial,"[r/NepalSocial] ANNFSU jholes who beat up police and vandalized university property are still walking free while random tiktokkers, rappers were arrested under ""electronic act"" for criticising Oli.  Ashika Tamang was jailed for three weeks to shut her up. Two-tier policing.",https://www.reddit.com/r/NepalSocial/comments/1rap9ss/annfsu_jholes_who_beat_up_police_and_vandalized/,↑193  💬15,"[https://www.ratopati.com/story/472475/annfsu-leader-acquitted-of-beating-soldier-on-duty](https://www.ratopati.com/story/472475/annfsu-leader-acquitted-of-beating-soldier-on-duty)

&gt;ड्युटीमा खटिएको सिपाहीलाई आक्रमण गर्नेलाई पक्राउ गरेर कारबाही गर्न मन्त्रीले निर्देशन दिनुपर्ने अवस्था आउनु ‘दुर्भाग्य’ भएको प्रहरी अधिकृतहरू बताउँछन् । एक पूर्वडीआईजीले रातोपाटीसँग भने– **‘ड्युटीमा कुटाइ खाँदा सङ्गठनले आरोपीलाई कारबाही गर्न खुट्टा कमाउनु दुर्भाग्य हो, यस्ता घटनाले प्रहरीको मनोबल कमजोर बनाउँछ ।’** 

&gt; **प्रहरी जवान नगेन्द्रराज विष्ट र हवल्दार जुगलाल घर्तीलाई जोशी नेतृत्वको टिमले आक्रमण गरेको भए पनि उनलाई अनुसन्धानको दायरामा नल्याइएको प्रहरी अधिकारीहरू बताउँछन् । प्रहरी वृत्त दरबारमार्गमा एकजना अधिकृत भन्छन्, ‘सिपाहीमाथि आक्रमण गर्नेहरूलाई विभागले नै जोगाएको छ ।’**

[https://myrepublica.nagariknetwork.com/news/cpn-umls-student-leaders-assault-policemen-in-thamel-57-78.html](https://myrepublica.nagariknetwork.com/news/cpn-umls-student-leaders-assault-policemen-in-thamel-57-78.html)

[https://www.ratopati.com/story/473046/akhil-leader-who-beat-up-police-in-thamel-not-under-investigation](https://www.ratopati.com/story/473046/akhil-leader-who-beat-up-police-in-thamel-not-under-investigation)

[The police arrested 31-year-old Rama Basnet on the charge of spreading false and misleading content through the video sharing platform, Tiktok. The Cyber ​​Bureau of Nepal Police has said that he was arrested on suspicion of spreading ethnic and communal incitement on Sunday](https://ekantipur.com/national/2025/06/15/en/ticketkar-rama-basnet-arrested-for-creating-untrue-content-55-40.html)

[Malum Rai has been charged under Nepal’s Electronic Transactions Act for uploading a rap video on YouTube that allegedly criticized Prime Minister KP Sharma Oli.](https://www.instagram.com/p/DJdv_qRypNS/)

[गुनासाे गर्ने युवतीलाई थुनाउने खानेपानीमन्त्रीको पक्षमा कार्यकर्ताद्वारा प्रदर्शन|](https://www.nayapatrikadaily.com/news-details/176801/2025-09-02)

[टिकटकर किरण साहविरुद्ध विद्युतीय अपराध, संघीय सांसदलाई धम्की दिएको र झूटो अफवाह फैलाएको आरोपमा दायर मुद्दामा अनुसन्धान जारी छ। जिल्ला प्रहरी कार्यालय पर्साका अनुसार तीन दिनको म्याद थप गरी साहमाथि यी तीनवटै मुद्दामा अनुसन्धान भइरहेको छ।](https://www.nayapatrikadaily.com/news-details/176801/2025-09-02)

[वीरगन्जमा हैजा नियन्त्रणबाहिर रहेको गुनासो गर्ने युवतीलाई थुनाउने खानेपानीमन्त्री प्रदीप यादवको पक्षमा उनका कार्यकर्ताले प्रदर्शन गरेका छन्। किरण साहलाई कारबाहीको माग गर्दै मंगलबार दिउँसो मन्त्रीका कार्यकर्ताले जिल्ला प्रहरी कार्यालय पर्साअगाडि प्रदर्शन गरेका हुन्। पानीको अभाव भएको समयमा खटिएर सहयोग गरेका जिल्लाका नेतालाई धम्की दिएको जिकिर गर्दै प्रदर्शनकारीले युवतीलाई कारबाहीको माग गरेका हुन्।](https://www.nayapatrikadaily.com/news-details/176801/2025-09-02)

[https://www.onlinekhabar.com/2025/05/1690663/when-the-navy-union-vandalized-the-vice-chancellors-office-in-front-of-the-police-with-video](https://www.onlinekhabar.com/2025/05/1690663/when-the-navy-union-vandalized-the-vice-chancellors-office-in-front-of-the-police-with-video)

[https://ekantipur.com/news/2025/06/05/en/ignoring-the-investigation-into-those-involved-in-vandalizing-the-vice-chancellors-office-40-11.html](https://ekantipur.com/news/2025/06/05/en/ignoring-the-investigation-into-those-involved-in-vandalizing-the-vice-chancellors-office-40-11.html)

&gt;The police have been indifferent to investigate and take action against those involved in the vandalism of the Tribhuvan University Vice-Chancellor's office. Even though the Executive Council of the University filed a complaint with the Kirtipur Police Circle to take action against those involved in the vandalism and pay compensation, the investigation and action process has not been initiated because the names have not been recorded.

&gt;The activists close to the ruling Congress, ransacked the secretariat of Vice Chancellor Khadge KC in front of the police last Wednesday. On 14th of June, the officers of SWVYU elected by the union in various campuses ransacked the office of Vice Chancellor KC and caused loss/damage to public property.

&gt;According to Trivi, the Sankardev Campus's Self-Secretary Madanraj Upadhyay, Joint Secretary Bhuvan Ojha as well as Gajendra Bam, Lokesh Kunwar, Sabin Bhatt, Sonu Sah, Kishore Thapa and Bhojraj were involved in the vandalism.

&gt;Swaviyu President Murari Gautam of Kailashkut Multipurpose Campus, Vaktar Karki of Sanothimi Campus, Rajesh Timilsina, Anja Phuyal of Kantipur College, Rohit Parajuli of Kavre Multipurpose Campus are involved in vandalism, according to Trivi. They have also taken responsibility for the vandalism by posting videos on Facebook

[https://www.onlinekhabar.com/2025/06/1695358/government-protects-those-who-vandalize-tribhuvan-university](https://www.onlinekhabar.com/2025/06/1695358/government-protects-those-who-vandalize-tribhuvan-university)

&gt;दलका विद्यार्थी संगठनका नेता–कार्यकर्ताबाट त्रिविका कार्यालय पटक-पटक फोरिएका छन्, पदाधिकारी प्रताडित भएका छन् । तर, तिनलाई कारबाही हुँदैन । किनभने, तिनले बलिया नेत",2.4,2026-03-05T15:07:06.550023
