Constituency,DistrictEnglish,DistrictNepali,CandidateEnglish,CandidateNepali,Source,Title,URL,Snippet,Content,RelevanceScore,ScrapedAt
2,bhaktapur,भक्तपुर,Rajesh Bade,राजेश बाडे,Reddit/r/NepalSocial,[r/NepalSocial] Two-tier policing. Rules don't apply to पहुंचवाला. Remember how police jailed Ashika Tamang for three weeks to teach her a lesson? Student union jholes who can beat up police and vandalize property are still walking free and have been promoted to high-ranking positions within the youth force.,https://www.reddit.com/r/NepalSocial/comments/1q4c1vw/twotier_policing_rules_dont_apply_to_पहचवल/,↑46  💬10,"Police le kati jana lai arrest garyo KP oli lai criticize garyo bhanera? Yo student union youth force jhole university vandalize gareko CCTV ma video bhae ni kei nahune? The interim government should push hard now that there’s no one protecting these thugs.

[The police arrested 31-year-old Rama Basnet on the charge of spreading false and misleading content through the video sharing platform, Tiktok. The Cyber ​​Bureau of Nepal Police has said that he was arrested on suspicion of spreading ethnic and communal incitement on Sunday](https://ekantipur.com/national/2025/06/15/en/ticketkar-rama-basnet-arrested-for-creating-untrue-content-55-40.html)

[Malum Rai has been charged under Nepal’s Electronic Transactions Act for uploading a rap video on YouTube that allegedly criticized Prime Minister KP Sharma Oli.](https://www.instagram.com/p/DJdv_qRypNS/)

[गुनासाे गर्ने युवतीलाई थुनाउने खानेपानीमन्त्रीको पक्षमा कार्यकर्ताद्वारा प्रदर्शन|](https://www.nayapatrikadaily.com/news-details/176801/2025-09-02)

[टिकटकर किरण साहविरुद्ध विद्युतीय अपराध, संघीय सांसदलाई धम्की दिएको र झूटो अफवाह फैलाएको आरोपमा दायर मुद्दामा अनुसन्धान जारी छ। जिल्ला प्रहरी कार्यालय पर्साका अनुसार तीन दिनको म्याद थप गरी साहमाथि यी तीनवटै मुद्दामा अनुसन्धान भइरहेको छ।](https://www.nayapatrikadaily.com/news-details/176801/2025-09-02)

[वीरगन्जमा हैजा नियन्त्रणबाहिर रहेको गुनासो गर्ने युवतीलाई थुनाउने खानेपानीमन्त्री प्रदीप यादवको पक्षमा उनका कार्यकर्ताले प्रदर्शन गरेका छन्। किरण साहलाई कारबाहीको माग गर्दै मंगलबार दिउँसो मन्त्रीका कार्यकर्ताले जिल्ला प्रहरी कार्यालय पर्साअगाडि प्रदर्शन गरेका हुन्। पानीको अभाव भएको समयमा खटिएर सहयोग गरेका जिल्लाका नेतालाई धम्की दिएको जिकिर गर्दै प्रदर्शनकारीले युवतीलाई कारबाहीको माग गरेका हुन्।](https://www.nayapatrikadaily.com/news-details/176801/2025-09-02)

We know their names and we have their faces on CCTV. Even the police admitted that no case was filed because of political pressure. 

[https://myrepublica.nagariknetwork.com/news/cpn-umls-student-leaders-assault-policemen-in-thamel-57-78.html](https://myrepublica.nagariknetwork.com/news/cpn-umls-student-leaders-assault-policemen-in-thamel-57-78.html)

[https://www.ratopati.com/story/473046/akhil-leader-who-beat-up-police-in-thamel-not-under-investigation](https://www.ratopati.com/story/473046/akhil-leader-who-beat-up-police-in-thamel-not-under-investigation)

[https://www.ratopati.com/story/472475/annfsu-leader-acquitted-of-beating-soldier-on-duty](https://www.ratopati.com/story/472475/annfsu-leader-acquitted-of-beating-soldier-on-duty)

&gt;ड्युटीमा खटिएको सिपाहीलाई आक्रमण गर्नेलाई पक्राउ गरेर कारबाही गर्न मन्त्रीले निर्देशन दिनुपर्ने अवस्था आउनु ‘दुर्भाग्य’ भएको प्रहरी अधिकृतहरू बताउँछन् । एक पूर्वडीआईजीले रातोपाटीसँग भने– **‘ड्युटीमा कुटाइ खाँदा सङ्गठनले आरोपीलाई कारबाही गर्न खुट्टा कमाउनु दुर्भाग्य हो, यस्ता घटनाले प्रहरीको मनोबल कमजोर बनाउँछ ।’** 

&gt; **प्रहरी जवान नगेन्द्रराज विष्ट र हवल्दार जुगलाल घर्तीलाई जोशी नेतृत्वको टिमले आक्रमण गरेको भए पनि उनलाई अनुसन्धानको दायरामा नल्याइएको प्रहरी अधिकारीहरू बताउँछन् । प्रहरी वृत्त दरबारमार्गमा एकजना अधिकृत भन्छन्, ‘सिपाहीमाथि आक्रमण गर्नेहरूलाई विभागले नै जोगाएको छ ।’**

Taukes are currently saying police morale is low while they turned a blind eye to this. Now is the time to boost morale by re-opening these cases and sending all the involved thugs to prison.

[https://www.onlinekhabar.com/2025/05/1690663/when-the-navy-union-vandalized-the-vice-chancellors-office-in-front-of-the-police-with-video](https://www.onlinekhabar.com/2025/05/1690663/when-the-navy-union-vandalized-the-vice-chancellors-office-in-front-of-the-police-with-video)

[https://ekantipur.com/news/2025/06/05/en/ignoring-the-investigation-into-those-involved-in-vandalizing-the-vice-chancellors-office-40-11.html](https://ekantipur.com/news/2025/06/05/en/ignoring-the-investigation-into-those-involved-in-vandalizing-the-vice-chancellors-office-40-11.html)

&gt;The police have been indifferent to investigate and take action against those involved in the vandalism of the Tribhuvan University Vice-Chancellor's office. Even though the Executive Council of the University filed a complaint with the Kirtipur Police Circle to take action against those involved in the vandalism and pay compensation, the investigation and action process has not been initiated because the names have not been recorded.

&gt;The activists close to the ruling Congress, ransacked the secretariat of Vice Chancellor Khadge KC in front of the police last Wednesday. On 14th of June, the officers of SWVYU elected by the union in various campuses ransacked the office of Vice Chancellor KC and caused loss/damage to public property.

&gt;According to Trivi, the Sankardev Campus's Self-Secretary Madanraj Upadhyay, Joint Secretary Bhuvan Ojha as well as Gajendra Bam, Lokesh Kunwar, Sabin Bhatt, Sonu Sah, Kishore Thapa and Bhojraj were involved in the vandalism.

&gt;Swaviyu President Murari Gautam of Kailashkut Multipurpose Campus, Vaktar Karki of Sanothimi Campus, Rajesh Timilsina, Anja P",2.4,2026-03-05T15:07:06.550024
2,bhaktapur,भक्तपुर,Rajesh Bade,राजेश बाडे,Reddit/r/NepalSocial,[r/NepalSocial] Rules for thee but not for me,https://www.reddit.com/r/NepalSocial/comments/1q5gn9q/rules_for_thee_but_not_for_me/,↑15  💬1,"&gt;Police officials say that even though police constable Nagendra Raj Bista and constable Juglal ​​Gharti were attacked by a team led by Joshi, they were not brought under the ambit of investigation. An officer at the Durbarmarg Police Circle says, ""The department itself has protected those who attacked the constables.""

&gt;SSP Bishwa Adhikari of the District Police Range, Kathmandu, has claimed that Joshi was not involved in the attack on the police. Speaking to Ratopati, the Adhikari said, ""The CCTV footage that he used to attack the police is visible, so there is no need to make him a defendant.""

&gt;The police have also filed weak cases against those arrested. Police Circle Durbarmarg is investigating the case of indecent assault against them, pending a decision by the Chief District Officer. It is customary for defendants in indecent assault cases to be released on general bail.

[Aru desh ma student union leading protest. Nepal ma police lai kutna sakne नेताका झोले.](https://www.reddit.com/r/NepalSocial/comments/1pdx9ek/these_thugs_have_been_promoted_to_highranking/)

&gt;The police have been indifferent to investigate and take action against those involved in the vandalism of the Tribhuvan University Vice-Chancellor's office. Even though the Executive Council of the University filed a complaint with the Kirtipur Police Circle to take action against those involved in the vandalism and pay compensation, the investigation and action process has not been initiated because the names have not been recorded.

&gt;The activists close to the ruling Congress, ransacked the secretariat of Vice Chancellor Khadge KC in front of the police last Wednesday. On 14th of June, the officers of SWVYU elected by the union in various campuses ransacked the office of Vice Chancellor KC and caused loss/damage to public property.

&gt;According to Trivi, the Sankardev Campus's Self-Secretary Madanraj Upadhyay, Joint Secretary Bhuvan Ojha as well as Gajendra Bam, Lokesh Kunwar, Sabin Bhatt, Sonu Sah, Kishore Thapa and Bhojraj were involved in the vandalism.

&gt;Swaviyu President Murari Gautam of Kailashkut Multipurpose Campus, Vaktar Karki of Sanothimi Campus, Rajesh Timilsina, Anja Phuyal of Kantipur College, Rohit Parajuli of Kavre Multipurpose Campus are involved in vandalism, according to Trivi. They have also taken responsibility for the vandalism by posting videos on Facebook

[https://www.onlinekhabar.com/2025/06/1695358/government-protects-those-who-vandalize-tribhuvan-university](https://www.onlinekhabar.com/2025/06/1695358/government-protects-those-who-vandalize-tribhuvan-university)

&gt;दलका विद्यार्थी संगठनका नेता–कार्यकर्ताबाट त्रिविका कार्यालय पटक-पटक फोरिएका छन्, पदाधिकारी प्रताडित भएका छन् । तर, तिनलाई कारबाही हुँदैन । किनभने, तिनले बलिया नेताको आड पाउँदै आएका छन् । उपकुलपति कार्यालयमा तोडफोडको भिडियो नै सार्वजनिक भएको छ । उक्त भिडियोमा तोडफोड गर्नेहरू सहजै पहिचान गर्न सकिन्छ । तोडफोड गर्नेहरू नेविसंघका नेता कार्यकर्ता हुन् तर नेविसंघले घटनाको जिम्मा लिएको छैन । बरु गृहमन्त्री रमेश लेखक र बुढानीलकण्ठसँग नजिक भएकाहरूले तोडफोड गरेको भन्दै कांग्रेस र नेविसंघका नेता पन्छिएका छन् ।

Thanks for making a submission. Please use an appropriate flair for better reach and response. In case of a NSFW post, tag it as NSFW and use ""sax sux” flair if it applies. Otherwise, the post will be removed.

*I am a bot, and this action was performed automatically. Please [contact the moderators of this subreddit](/message/compose/?to=/r/NepalSocial) if you have any questions or concerns.*",2.4,2026-03-05T15:07:06.550026
