Constituency,DistrictEnglish,DistrictNepali,CandidateEnglish,CandidateNepali,Source,Title,URL,Snippet,Content,RelevanceScore,ScrapedAt
1,tanahu,तनहुँ,Manjil Rana,मन्‍जिल राना,Ratopati,"उदयपुरमा मोटरसाइकल रुखमा ठोक्किँदा एकको मृत्यु, दुई जना गम्भीर घाइते",https://www.ratopati.com/story/548190/one-dead-two-seriously-injured-after-motorcycle-crashes-into-tree-in-udayapur,,"उदयपुरमा मोटरसाइकल रुखमा ठोक्किँदा एकको मृत्यु, दुई जना गम्भीर घाइते रातोपाटी संवाददाता बिहीबार, २१ फागुन २०८२, १२ : ५१ रातोपाटी संवाददाता बिहीबार, २१ फागुन २०८२ सारांश उदयपुरको चौदण्डीगढीमा मोटरसाइकल दुर्घटना हुँदा एक जनाको मृत्यु भएको छ। दुर्घटनामा दुई जना गम्भीर घाइते भएका छन् र उनीहरूको विराटनगरमा उपचार भइरहेको छ। प्रहरीले घटनाको अनुसन्धान गरिरहेको छ, तीव्र गति र तीन जना सवार हुनु दुर्घटनाको कारण हुनसक्ने अनुमान छ। उदयपुर । उदयपुरको चौदण्डीगढी नगरपालिकामा आज बिहान मोटरसाइकल दुर्घटना हुँदा एक जनाको मृत्यु भएको छ भने दुई जना गम्भीर घाइते भएका छन् । मदन भण्डारी लोकमार्ग अन्तर्गत चौदण्डीगढी नगरपालिका वडा नं। १० भिमा खण्डमा गाईघाटबाट बेल्टारतर्फ जाँदै गरेको प्र.०१-०५-००२ प १८२७ नम्बरको मोटरसाइकल अनियन्त्रित भई दुर्घटना भएको हो । तीव्र गतिमा रहेको मोटरसाइकल सडकको उत्तरतर्फ रहेको सखुवाको रुखमा ठोक्किँदा मोटरसाइकल चालक चौदण्डीगढी नगरपालिका–५ सिवाई बस्ने १८ वर्षीय समिर चौधरीको मृत्यु भएको प्रहरीले जनाएको छ । दुर्घटनामा गम्भीर घाइते भएका चौधरीलाई तत्काल उद्धार गरी नगर अस्पताल बेल्टार लगिएकोमा अस्पताल पुर्‍याउनासाथ चिकित्सकले मृत घोषणा गरेका थिए । सोही दुर्घटनामा परी मोटरसाइकलमा सवार अन्य दुई जना गम्भीर घाइते भएका छन् । घाइते हुनेहरूमा चौदण्डीगढी–५ सिवाई बस्ने १८ वर्षीय मौसम चौधरी र सोही ठाउँका २३ वर्षीय अशोक चौधरी रहेका छन् । घाइते दुवै जनालाई नगर अस्पतालमा सामान्य उपचारपछि थप उपचारका लागि विराटनगरस्थित सुविधा सम्पन्न अस्पतालमा रेफर गरिएको छ । बिहान करिब ११:०० बजे भएको उक्त दुर्घटनाको विषयमा इलाका प्रहरी कार्यालय बेल्टारबाट खटिएको प्रहरी टोलीले थप अनुसन्धान गरिरहेको जनाएको छ । एउटै मोटरसाइकलमा तीन जना सवार रहेकाले अनियन्त्रित भई दुर्घटना भएको हुनसक्ने प्रारम्भिक अनुमान गरिएको छ । घाइते मोटरसाइकल दुर्घटना उदयपुर दुर्घटना खबर पढेर तपाईलाई कस्तो महसुस भयो ? प्रतिक्रिया लेखकको बारेमा रातोपाटी संवाददाता ‘सबैको, सबैभन्दा राम्रो’ रातोपाटी डटकम। लेखकबाट थप भर्खरै परिवर्तनको आशा बोकेर मतदान हुम्लाको हल्जीमा गुम्बामा मतपेटिका पुर्‍याउन माग गरेपछि विवाद रुपन्देहीमा ५० प्रतिशत मत खस्यो रञ्जु दर्शनाले गरिन् मतदान भारत-इङ्ल्यान्ड सेमिफाइनल : मौसम अनुकूल हुँदा वानखेडेमा बन्न सक्छ उच्च स्कोर पर्साको चार वटा निर्वाचन क्षेत्रमा कहाँ कति मत खस्यो ? ट्रेन्डिङ १. मतदान केन्द्रमा खटिएका कर्मचारी नै पक्राउ परेपछि... २. गन्तव्यमा नपुगी किन फर्कियो बालेन सवार हेलिकप्टर ? ३. बालेन चढेको हेलिकप्टर झापामा ल्यान्ड गरेन, काठमाडौँ फर्कँदै ४. श्रीलंका नजिकै इरानी युद्धपोतमा अमेरिकी आक्रमण, ८० नौसैनिकको मृत्यु ५. बुटवलमा पैसा बाँडेको आरोपमा एमाले र रास्वपाका कार्यकर्ताबिच झडप ६. कर्मचारीमाथि हातपात गर्न खोजेपछि दोलखामा हवाई फायर ७. चुनावमा खटिएका १२ जना सुरक्षाकर्मी र दुई मतदान अधिकृतको मृत्यु ८. राष्ट्रिय सुरक्षा परिषद्को बैठकले के गर्‍याे निर्णय ? छुटाउनुभयो कि ? निर्वाचन बहिष्कार गर्दै आन्दोलनको घोषणा प्रतिनिधि सभा उम्मेदवारले नै पार्टी छाडेपछि... प्रतिनिधि सभा उम्मेदवार पौडेलले फिर्ता लिए उम्मेदवारी रास्वपा र एमालेका कार्यकर्ताबिच झडप, २ जना घाइते धादिङमा बस दुर्घटना: १७ जनाको मृत्यु, २४ घाइते गौर झडप : ३ गाडी र दुई मोटरसाइकलमा आगजनी धादिङ बस दुर्घटनाः मृत्यु भएका १९ मध्ये ९ जनाको सनाखत (नामावलीसहित) बालेनलाई कारबाहीसहित नागरिकता रद्दको माग गर्दै गृह मन्त्रालयमा उजुरी",4.5,2026-03-05T15:05:09.661862
1,tanahu,तनहुँ,Manjil Rana,मन्‍जिल राना,Ratopati,ओखलढुंगाको मानेभन्ज्याङका मतदाताले गरेनन् मतदान,https://www.ratopati.com/story/548144/voters-in-manebhanjyang-okhaldhunga-did-not-vote,,"ओखलढुंगाको मानेभन्ज्याङका मतदाताले गरेनन् मतदान रातोपाटी संवाददाता बिहीबार, २१ फागुन २०८२, ११ : १९ रातोपाटी संवाददाता बिहीबार, २१ फागुन २०८२ सारांश ओखलढुंगाको टोक्सेलस्थित मतदान केन्द्रका मतदाताहरूले मतदान बहिष्कार गरेका छन्। स्थानीयहरू प्रदेश सरकारले अस्पताल नबनाएको विरोधमा नो भोटमा उत्रिएका थिए। मुख्य निर्वाचन अधिकृतका अनुसार उक्त मतदान केन्द्रमा ७०१ मतदाता रहेका थिए। काठमाडौँ । ओखलढुंगाको एक मतदान केन्द्रका मतदाताहरुले मतदान बहिस्कार गरेका छन् । जिल्लाको मानेभञ्ज्याङ गाउँपालिका–७ को टोक्सेलस्थित मतदान केन्द्रमा मतदाताहरू मतादनमा सहभागी नभएको मुख्य निर्वाचन अधिकृत हरिप्रसाद कोइरालाले जानकारी दिए । स्थानीयले मत नहालेको खबरपछि आफू उक्त मतदान केन्द्र पुग्दा कोही पनि मतदाता उपस्थित नभएको पाइएको मुख्य निर्वाचन अधिकृत कोइरालाले बताए । ‘त्यहाँका मतदाता नो भोटमा उत्रिएको पाइयो । यो जानकारी आयोगका कार्यवहाक प्रमुख निर्वाचन आयुक्तलाई जानकारी गराइसकेको छु’, कोइरालाले रातोपाटीसँग भने । ‘जनप्रतिनिधिहरू गएर मुचुल्का गरिदिनुभएको छ । कर्मचारीहररू बसिरहनुभएको छ । भरे बेलुकासम्म कर्मचारीहररूको समानुपातिक जति भोट खस्छ त्यही मुचुल्का उठाएर पठाउँछौ’, मुख्य निर्वाचन अधिकृत कोइरालाले भने । मानेभञ्ज्याङ गाउँपालिकाका अध्यक्ष ज्ञानेन्द्र रूम्दालीले उक्त मतदान केन्द्रमा ७०१ जना मतदाता रहे पनि कोही पनि मतदानमा सहभागी नभएको बताए । उनका अनुसार प्रदेश सरकारले त्यस क्षेत्रमा प्रादेशिक अस्पताल बनाउने भने पनि काम सुरू नगरेको भन्दै स्थानीयहरू विरोधमा उत्रिएर मतदानमा सहभागी नभएको बताए । मतदान बहिस्कार ओखलढुंगा खबर पढेर तपाईलाई कस्तो महसुस भयो ? प्रतिक्रिया लेखकको बारेमा रातोपाटी संवाददाता ‘सबैको, सबैभन्दा राम्रो’ रातोपाटी डटकम। लेखकबाट थप भर्खरै परिवर्तनको आशा बोकेर मतदान हुम्लाको हल्जीमा गुम्बामा मतपेटिका पुर्‍याउन माग गरेपछि विवाद रुपन्देहीमा ५० प्रतिशत मत खस्यो रञ्जु दर्शनाले गरिन् मतदान भारत-इङ्ल्यान्ड सेमिफाइनल : मौसम अनुकूल हुँदा वानखेडेमा बन्न सक्छ उच्च स्कोर पर्साको चार वटा निर्वाचन क्षेत्रमा कहाँ कति मत खस्यो ? ट्रेन्डिङ १. मतदान केन्द्रमा खटिएका कर्मचारी नै पक्राउ परेपछि... २. गन्तव्यमा नपुगी किन फर्कियो बालेन सवार हेलिकप्टर ? ३. बालेन चढेको हेलिकप्टर झापामा ल्यान्ड गरेन, काठमाडौँ फर्कँदै ४. श्रीलंका नजिकै इरानी युद्धपोतमा अमेरिकी आक्रमण, ८० नौसैनिकको मृत्यु ५. बुटवलमा पैसा बाँडेको आरोपमा एमाले र रास्वपाका कार्यकर्ताबिच झडप ६. कर्मचारीमाथि हातपात गर्न खोजेपछि दोलखामा हवाई फायर ७. चुनावमा खटिएका १२ जना सुरक्षाकर्मी र दुई मतदान अधिकृतको मृत्यु ८. राष्ट्रिय सुरक्षा परिषद्को बैठकले के गर्‍याे निर्णय ? छुटाउनुभयो कि ? निर्वाचन बहिष्कार गर्दै आन्दोलनको घोषणा प्रतिनिधि सभा उम्मेदवारले नै पार्टी छाडेपछि... प्रतिनिधि सभा उम्मेदवार पौडेलले फिर्ता लिए उम्मेदवारी रास्वपा र एमालेका कार्यकर्ताबिच झडप, २ जना घाइते धादिङमा बस दुर्घटना: १७ जनाको मृत्यु, २४ घाइते गौर झडप : ३ गाडी र दुई मोटरसाइकलमा आगजनी धादिङ बस दुर्घटनाः मृत्यु भएका १९ मध्ये ९ जनाको सनाखत (नामावलीसहित) बालेनलाई कारबाहीसहित नागरिकता रद्दको माग गर्दै गृह मन्त्रालयमा उजुरी",4.5,2026-03-05T15:05:09.661867
1,tanahu,तनहुँ,Manjil Rana,मन्‍जिल राना,DDG (en1),Nepal Parliamentary Elections 2026/2082 - All Candidates List,https://nepsedata.com/nepal-election-2026-2082/,Welcome to the complete list ofcandidatesforNepal's2026 AD / 2082 BS ParliamentaryElections. This page shows all thecandidatesrunning for seats in the House of Representatives across all seven provinces ofNepal. Each province section below contains all constituencies (electionareas) in that province.,Welcome to the complete list ofcandidatesforNepal's2026 AD / 2082 BS ParliamentaryElections. This page shows all thecandidatesrunning for seats in the House of Representatives across all seven provinces ofNepal. Each province section below contains all constituencies (electionareas) in that province.,4.2,2026-03-05T15:05:09.661871
1,tanahu,तनहुँ,Manjil Rana,मन्‍जिल राना,DDG (en2),Nepal Election 2082 - Live Results & Candidate Tracker,https://2082.live/,"TrackNepal's2082FederalElectionlive results with real-time vote counting, interactiveconstituencymaps, and comprehensive candidate analytics.","TrackNepal's2082FederalElectionlive results with real-time vote counting, interactiveconstituencymaps, and comprehensive candidate analytics.",4.2,2026-03-05T15:05:09.661874
1,tanahu,तनहुँ,Manjil Rana,मन्‍जिल राना,DDG (en2),Tanahu Constituency No. 1 - Election 2082 - ChangeNepal,https://www.changenepal.org/election/constituency/tanahu-1-election-result-live-election-2082,Results and candidates for Tanahu-1.Nepalelection2082.,Results and candidates for Tanahu-1.Nepalelection2082.,4.2,2026-03-05T15:05:09.661879
1,tanahu,तनहुँ,Manjil Rana,मन्‍जिल राना,DDG (ne1),तनहुँ - १ - Nepal Election 2082 Results & Updates | OnlineKhabar,https://election.onlinekhabar.com/central-chetra/tanahu1,"तनहुँ- १ constituency profile, voter insights, candidate list, and Nepal Election 2082 updates on OnlineKhabar.","तनहुँ- १ constituency profile, voter insights, candidate list, and Nepal Election 2082 updates on OnlineKhabar.",3.9,2026-03-05T15:05:09.661882
1,tanahu,तनहुँ,Manjil Rana,मन्‍जिल राना,Reddit/r/Nepal,[r/Nepal] What is your honest opinion of B.P. Koirala?,https://www.reddit.com/r/Nepal/comments/1q10ix6/what_is_your_honest_opinion_of_bp_koirala/,↑146  💬78,"Bishweshwar Prasad Koirala (B.P. Koirala) was the first democratically elected Prime Minister of Nepal. He served as Prime Minister from 1959 to 1960.

**Former PM:** Subarna Shamsher Rana

**Authority under:** King Mahendra

**Born:** 8 September 1914
Varanasi, British Raj (now India)

**Died:** 21 July 1982 Kathmandu, Nepal (aged 67)

**Political Party:** Nepali Congress

**Wife:** Sushila Koirala

The whole royal family feared him not because he was popular or held political influence but because he had ideals and was true to them absolute legend and not as much appreciated as much as he should be
---
Probably the best ~~novelist~~ literary writer the country produced, who also happens to have a great understanding of politics and helped overthrow the Rana regime. I also like his idea of democratic socialism in the Nepali context, although I don't think it would work as intended.
---
One of the greatest political / social heroes of the world...

Him, being a Nepali became a geographical mistake otherwise he was simply someone of a very high stature.If you don't believe me,find out what the world thinks about Nehru,Koirala was no different but greater in a lot of ways...
---
I have been reading his autobiography recently and what a great man he was. The clarity of thoughts he had was simply incredible.


I have read and heard a lot about India's freedom fighters, leaders and their ideologies and life but as a nepali, I feel ashamed that I didn't know much about this great man. 


Just ask any Indian and they  literally celebrate Nehru, ghandi, Ambedkar as national heroes for their contributions to their freedom but it kinda feels like BP koirala has been sidelined by our own history.I could be wrong here as this is just me assuming anecdotally but we gotta give this man much more credit for his contributions to our country.
---
He died leaving behind sinful scums
---
He became PM at the age of 44. Now look at the ages of PM
---
I think he was a great leader who wasn't allowed to fulfill his potential and I always wonder what would have happened if BP and Mahendra actually worked together for better Nepal or he was allowed to complete his full 5 year term after 2015 BS General election. The problem of course for Mahendra was that Nepali Congress had two thirds majority in Parliament and he always believed with that much majority the monarchy itself was threatened. 

I have also read some articles where it is said that Mahendra actually borrowed some of BP's policies like land reform policies among others. Mahendra died too soon as well.",3.9,2026-03-05T15:05:09.661884
