Constituency,DistrictEnglish,DistrictNepali,CandidateEnglish,CandidateNepali,Source,Title,URL,Snippet,Content,RelevanceScore,ScrapedAt
1,tanahu,तनहुँ,Manjil Rana,मन्‍जिल राना,Nepali Times,West Asia war and Nepalis,https://www.nepalitimes.com/news/west-asia-war-and-nepalis,,"West Asia war and Nepalis Two million Nepalis live and work in the Gulf region that is the mainstay of country’s economy through remittances 28 February 2026 Nepali Times 0 Passengers at Kathmandu airport waiting for flights on Saturday evening. On Saturday, Iran retaliated with missile strikes on Abu Dhabi, Dubai, Bahrain and Qatar, a region where there are an estimated 2 million Nepalis working to send money home. In addition, thousands of Nepalis were preparing to board flights to Kathmandu from West Asian cities this weekend to vote in the 5 March election. Many are said to be stranded at various aviation hubs. A Qatar Airways flight from Doha took off just before the air space was closed, while Air Arabia and Kuwait Airways have diverted or cancelled flights. Nepalis in the West Asian region said things were relatively calm where they were, although some heard loud explosions at about noon local time. In Dubai, some thought they were Ramadan fireworks. In Kuwait, nearly 2,000 Nepalis working in the US military base as security guards and cleaners were evacuated before the strikes. In Bahrain where the US Fifth Fleet naval base is located and which was hit by two Iranian missiles, workers contacted by Nepali Times said the situation was under control and the authorities had told everyone to stay indoors and not use highways. The conflict also coincided with the beginning of Nepal’s trekking and mountaineering season, and tourists were either on their way or planning to leave European and North American cities for Himalayan hikes. Most of them transit through Doha, Dubai or Kuwait and all three airports are closed. Turkish Airlines flights via Istanbul are still operating. Qatar and UAE airspace closed. Credit: Flightradar24 However, the main impact for the world could be a spike in the price of petroleum products if the strategic Strait of Hormuz is blocked. China relies on Iranian oil for their refineries, and Nepal could be affected indirectly if the economies of its neighbours are hit. Nepal imports all its diesel, petrol, LPG and aviation fuel from India which sources it mainly from the Gulf, and until recently from Russia. Petroleum makes up 25% of the value of all imports, and that is more than Nepal earns from all its exports. Saudi Arabia this year overtook the UAE as the main destination for Nepali workers, with the number now totalling 400,000. There are said to be as many in the UAE, and another 350,000 in Qatar. There are another 100,000 mostly women in Kuwait, and 50,000 each in Oman and Bahrain. Iran retaliated with missile strikes on Abu Dhabi, Dubai, Bahrain and Qatar on Saturday. Nepal receives nearly $11 billion a year in remittances from overseas Nepalis (not counting India) through official channels, although the total is said to be much more.  This makes up more than a quarter of Nepal’s GDP equivalent — one of the highest proportions in the world. More than half of the overseas remittances to Nepal comes from its workers in the Gulf, and it is the mainstay of the country’s economy. Nepalis in Saudi Arabia, Qatar and the UAE alone send home more than $3 billion a year, much of that helping support their families back home. An average Nepali worker in the Gulf sends home nearly $2,500 a year, and this is spent mainly for household supplies, children’s education and healthcare. There are also an estimated 7,000 Nepali caregivers and healthcare workers in Israel, and most of them are women. The Nepal Embassy has asked Nepalis in Israel to take caution and move to bomb shelters. Tags overseas Nepalis West Asia conflict Gulf countries",2.7,2026-03-05T15:05:09.661928
1,tanahu,तनहुँ,Manjil Rana,मन्‍जिल राना,DDG (en2),"Chunab | Nepal Election Information Portal | Candidates, Agendas & Live ...",https://www.chunab.org/,"Stay updated with the2082electioninformation inNepal. Explore candidate profiles, bios, agendas, and real-time vote counts across all regions. Your trusted source for transparent and accessibleelectionupdates.","Stay updated with the2082electioninformation inNepal. Explore candidate profiles, bios, agendas, and real-time vote counts across all regions. Your trusted source for transparent and accessibleelectionupdates.",2.4,2026-03-05T15:05:09.661931
1,tanahu,तनहुँ,Manjil Rana,मन्‍जिल राना,Reddit/r/Nepal,[r/Nepal] What are you reamarks and opinion on Indira Rana Magar and Devraj Ghimire.,https://www.reddit.com/r/Nepal/comments/1qjna54/what_are_you_reamarks_and_opinion_on_indira_rana/,↑2  💬7,"I am from jhapa 2 and want to know all of nepal's opinion on this election area and candidates.

Swagat nepal le jitne chance dherai xa. Devraj party ko veda ho, indira ko barema k vannu aba samajsebi ho politics ma ako manxe, misplace vako ho.
---
Indira Rana Magar is the best of the two, which should be obvious to you and anyone capable of critical thinking. Why? Simple, communism sounds great, and in practice, it has yet to deliver on its promises, regardless of where it is implemented on the societal level. C'mon now
---
Hāmīlē bharkharai sānskr̥tika krānti garyauṁ ra sarakāralā'ī ulṭāyauṁ ra hāmrō vyavahāralā'ī pani ulṭāyauṁ, mānauṁ hāmīlē tyastō um'mēdavāra uṭhā'una sakdainauṁ jasalā'ī hāmīlē vāstavamā matadāna garna sakauṁ, na ki hāmīlē virud'dhamā matadāna garnuparnē um'mēdavāraharūlā'ī.
---
Indira rana- ngo wali, USma manav taskari muddha lageko, fake letter banaera manche bidesh pathako

Devrag- mahakali sandi ma manmohan ko name ma sign garera desh dubako chor",2.4,2026-03-05T15:05:09.661935
1,tanahu,तनहुँ,Manjil Rana,मन्‍जिल राना,DDG (en1),Candidate Calls Black Flag Incident During Magar Day Event a Peaceful ...,https://english.ratopati.com/story/50938/black-flag-incident-in-tanahun-manjil-rana-gives-clarification,"Tanahun.ManjilRana, thecandidatefor UjyaloNepalParty from Tanahun-1, issued a press release stating that the black flag incident observed during the Magar Day program was a peaceful expression of dissent.","Tanahun.ManjilRana, thecandidatefor UjyaloNepalParty from Tanahun-1, issued a press release stating that the black flag incident observed during the Magar Day program was a peaceful expression of dissent.",2.1,2026-03-05T15:05:09.661939
1,tanahu,तनहुँ,Manjil Rana,मन्‍जिल राना,DDG (ne1),Election Commission Nepal,https://election.gov.np/np/district/tanahun,Official Website Of Election Commision Nepal प्रदेशनिर्वाचनकार्यालयहरू निर्वाचनका ...,Official Website Of Election Commision Nepal प्रदेशनिर्वाचनकार्यालयहरू निर्वाचनका ...,1.8,2026-03-05T15:05:09.661944
