Constituency,DistrictEnglish,DistrictNepali,CandidateEnglish,CandidateNepali,Source,Title,URL,Snippet,Content,RelevanceScore,ScrapedAt
1,tanahu,तनहुँ,Manjil Rana,मन्‍जिल राना,DDG (ne1),मन्‍जिल राना :: Nepal Election 2082 | Thaha Khabar Candidate & Results Hub,https://election.thahakhabar.com/candidate-detail/2354,गण्डकी जिल्ला (District)तनहुँनिर्वाचनक्षेत्र (Constituency)तनहुँ- १ उम्मेदवारहरु,गण्डकी जिल्ला (District)तनहुँनिर्वाचनक्षेत्र (Constituency)तनहुँ- १ उम्मेदवारहरु,27.0,2026-03-05T15:05:09.661813
1,tanahu,तनहुँ,Manjil Rana,मन्‍जिल राना,DDG (en1),Strong message from Ujyalo Nepal Tanahu-1 candidate Manjil Rana Ujyalo ...,https://www.facebook.com/reel/2166936980506742/,"घरदैलो कार्यक्रम 3 days ago · 2.5K views 00:30 Kulman Ghising excellentelectioncampaign 3 days ago · 3.7K views 00:21 Kulman Ghising Kathmandu-3electioncampgain Feb 26, 2026 · 8K views 00:39 Strong message fromManjilRanaTanahu-1 Feb 26, 2026 · 9.7K views 00:40","घरदैलो कार्यक्रम 3 days ago · 2.5K views 00:30 Kulman Ghising excellentelectioncampaign 3 days ago · 3.7K views 00:21 Kulman Ghising Kathmandu-3electioncampgain Feb 26, 2026 · 8K views 00:39 Strong message fromManjilRanaTanahu-1 Feb 26, 2026 · 9.7K views 00:40",22.0,2026-03-05T15:05:09.661829
1,tanahu,तनहुँ,Manjil Rana,मन्‍जिल राना,DDG (en1),Strong message from Ujyalo Nepal Tanahu-1 candidate Manjil Rana. # ...,https://www.youtube.com/watch?v=XVvkoLb0ROw,Strong message from UjyaloNepalTanahu-1candidateManjilRana. #kulmanghising #ujyalonepalparty #ujyalonepal #election2026,Strong message from UjyaloNepalTanahu-1candidateManjilRana. #kulmanghising #ujyalonepalparty #ujyalonepal #election2026,20.0,2026-03-05T15:05:09.661832
1,tanahu,तनहुँ,Manjil Rana,मन्‍जिल राना,Nepali Times,Nepalis Select Who To Elect,https://www.nepalitimes.com/news/nepalis-select-who-to-elect,,"Nepalis Select Who To Elect It is a partial poll when a quarter of the eligible electorate cannot vote? 27 February 2026 Sonia Awale 0 Photo: NT ARCHIVES Of the nearly 19 million eligible voters in next week’s election in Nepal, an estimated 5 million are abroad and cannot cast their ballots. Many others within Nepal must travel to their home districts, and might decide not to because of the cost. Flights into Kathmandu these days are full of global Nepalis returning just to vote, but almost as many are leaving for overseas jobs. Most of those coming or going are in the 20-40 age group, and a majority want Nepal to see a change in leadership. Bangladesh held an election this month in which citizens overseas could vote by mail. “Bangladesh made maximum use of technology not just for campaigning but also for polling itself. We could have also managed this, so people within Nepal did not have to travel to their home districts to vote,” says Mohna Ansari, former head of Nepal’s National Human Rights Commission who was an election observer in Bangladesh. A 3-day holiday has been declared so people can travel to their home constituencies to cast ballots. Even if there was not enough time to manage ballots for overseas Nepalis, it could have been done for Nepalis within Nepal. Former Chief Election Commissioner Bhojraj Pokharel reckons that physical voting in countries with a large Nepali diaspora would have been a logistical nightmare, but in the PR system, using electronic voting machines or paper ballot could have been piloted in some places. It is not possible to manage the entire voting process until we introduce the internet voting system. “First of all, there needs to be political will to bring the policy and be ready to undertake that level of investment and it is not a one-time cost,” Pokharel says. “A government formed by the GenZ could have atr least issed an ordinance ensuring this right, piloted out-of-country voting where possible, which could have built pressure for the future Parliament and the government. It would have given people hope. It is a lost opportunity.” All major political parties called for voting rights for global Nepalis in their manifestos, but these very leaders blocked legislation allowing it despite a 2017 Supreme Court ruling out of fear that it would be anti-incumbent. Why so late? Bangladesh delivered election results in just one day, but the final results of Nepal's last local polls in 2022 including that of Kathmandu constituencies took nearly a month. Acting Chief Election Commissioner Ram Prasad Bhandari said this week that the results of the First-Past-The-Post (FPTP) ballot counting would “likely” be published within 24 hours of the poll closing at 5PM on 5 March. But many are skeptical. “I wonder if we lack the capacity or know-how to announce results as quickly as possible,” says Mohna Ansari. Former Chief Election Commissioner Pokharel says manual ballot paper counting in Nepal is inherently slow because of the large numner of political parties and/or candidates on the ballot, the counting mechanism, the political behaviour of the candidates/parties and some managerial issues during counting. “Our present policy is to count all the ballot papers at the returning officers' officies, located at the district headquarters. It requires collecting ballot boxes safetly first. This takes time, and there have been cases of ballot boxes being damaged or stolen during transport. In a few highly difficult, geographically remote polling centres, we use a helicopter or transport. But sometimes, accommodating the party and candidates' representatives remains challenging,” explains Pokharel. A solution could be counting ballots at the very booths where they are cast. Another reason for the delay is simply the number of political parties, and the need for each ballot paper to be examined by booth representatives for consensus. In close races, the smallest difference can lead to tense situations, further delaying results, even though counting centres are protected by metal fencing so there is no disruption. After this, then it is the turn of Proportional Representation (PR) ballots to be counted. Weeks pass by the time the results of candidates and parties are tallied and verified. But the most common delay is because election officers think ballot counting is a nine-to-five job. “The efficiency of poll station officers is most important, and they are incentivised for this,” says Ansari, adding that counting can even start within an hour after voting closes. In remote areas, local resources could be mobilised to make counting quicker, but there is a crisis of trust, adds Ansari. That could be easily solved with electronic voting which the EC implemented in the 2008 polls but discontinued because political parties felt the machines could be hacked or manipulated. Sonia Awale writer Sonia Awale is the Editor of Nepali Times where she also serves as the health, science and environment cor",7.2,2026-03-05T15:05:09.661835
1,tanahu,तनहुँ,Manjil Rana,मन्‍जिल राना,DDG (en2),Tanahun Constituency 1 - House of Representatives Election 2082 Results ...,https://election.nepsebajar.com/en/pratinidhi/29/tanahun-1-election-result-live-election-2082,"Liveelectionresults for TanahunConstituencyNo.1in theNepalFederal Parliament (House of Representatives)Election2082. View vote counts, candidate details, andconstituencyanalysis. The voter age breakdown includes: 9,819 (18-25), 44,576 (26-40), 42,687 (41-60), and 29,773 (61+).","Liveelectionresults for TanahunConstituencyNo.1in theNepalFederal Parliament (House of Representatives)Election2082. View vote counts, candidate details, andconstituencyanalysis. The voter age breakdown includes: 9,819 (18-25), 44,576 (26-40), 42,687 (41-60), and 29,773 (61+).",6.6,2026-03-05T15:05:09.661839
1,tanahu,तनहुँ,Manjil Rana,मन्‍जिल राना,DDG (ne1),तनहुँ-१ : प्रदेश ४ - प्रतिनिधिसभाको निर्वाचन २०८२ विवरण तथा नतिजा,https://election.ekantipur.com/pradesh-4/district-tanahun/constituency-1?lng=nep,"तनहुँ-१ : गण्डकी प्रदेश - नेपालनिर्वाचन२०८२ को प्रतिनिधिसभानिर्वाचनसम्बन्धी ताजा नतिजा,उम्मेदवारविवरण, मतगणना अपडेट र ...","तनहुँ-१ : गण्डकी प्रदेश - नेपालनिर्वाचन२०८२ को प्रतिनिधिसभानिर्वाचनसम्बन्धी ताजा नतिजा,उम्मेदवारविवरण, मतगणना अपडेट र ...",5.4,2026-03-05T15:05:09.661845
1,tanahu,तनहुँ,Manjil Rana,मन्‍जिल राना,Ratopati,कांग्रेस नेता डा.कोइरालाद्वारा मतदान,https://www.ratopati.com/story/548169/congress-leader-dr-koirala-casts-his-vote,,"कांग्रेस नेता डा.कोइरालाद्वारा मतदान रासस बिहीबार, २१ फागुन २०८२, १२ : ११ फाइल तस्बिर रासस बिहीबार, २१ फागुन २०८२ मोरङ ।  नेपाली कांग्रेसका डा.शेखर कोइरालाले विराटनगर महानगरपालिका–७ स्थित आदर्श माविमा रहेको मतदान केन्द्रबाट मतदान गरेका छन् । मोरङ क्षेत्र नं ६ का उम्मेदवारसमेत रहनुभएका डा शेखर कोइरालाले मतदानपछि पत्रकारसँग संक्षिप्त कुराकानी गर्दै सबैको आपसी सहकार्य र समन्वयबाट मुलुक निर्माणमा लाग्नुपर्ने धारणा राखे । डा.शेखर कोइराला खबर पढेर तपाईलाई कस्तो महसुस भयो ? प्रतिक्रिया लेखकको बारेमा रासस राष्ट्रिय समाचार समिति नेपालकाे  सरकारी समाचार संस्था हाे । लेखकबाट थप भर्खरै परिवर्तनको आशा बोकेर मतदान हुम्लाको हल्जीमा गुम्बामा मतपेटिका पुर्‍याउन माग गरेपछि विवाद रुपन्देहीमा ५० प्रतिशत मत खस्यो रञ्जु दर्शनाले गरिन् मतदान भारत-इङ्ल्यान्ड सेमिफाइनल : मौसम अनुकूल हुँदा वानखेडेमा बन्न सक्छ उच्च स्कोर पर्साको चार वटा निर्वाचन क्षेत्रमा कहाँ कति मत खस्यो ? ट्रेन्डिङ १. मतदान केन्द्रमा खटिएका कर्मचारी नै पक्राउ परेपछि... २. गन्तव्यमा नपुगी किन फर्कियो बालेन सवार हेलिकप्टर ? ३. बालेन चढेको हेलिकप्टर झापामा ल्यान्ड गरेन, काठमाडौँ फर्कँदै ४. श्रीलंका नजिकै इरानी युद्धपोतमा अमेरिकी आक्रमण, ८० नौसैनिकको मृत्यु ५. बुटवलमा पैसा बाँडेको आरोपमा एमाले र रास्वपाका कार्यकर्ताबिच झडप ६. कर्मचारीमाथि हातपात गर्न खोजेपछि दोलखामा हवाई फायर ७. चुनावमा खटिएका १२ जना सुरक्षाकर्मी र दुई मतदान अधिकृतको मृत्यु ८. राष्ट्रिय सुरक्षा परिषद्को बैठकले के गर्‍याे निर्णय ? छुटाउनुभयो कि ? निर्वाचन बहिष्कार गर्दै आन्दोलनको घोषणा प्रतिनिधि सभा उम्मेदवारले नै पार्टी छाडेपछि... प्रतिनिधि सभा उम्मेदवार पौडेलले फिर्ता लिए उम्मेदवारी रास्वपा र एमालेका कार्यकर्ताबिच झडप, २ जना घाइते धादिङमा बस दुर्घटना: १७ जनाको मृत्यु, २४ घाइते गौर झडप : ३ गाडी र दुई मोटरसाइकलमा आगजनी धादिङ बस दुर्घटनाः मृत्यु भएका १९ मध्ये ९ जनाको सनाखत (नामावलीसहित) बालेनलाई कारबाहीसहित नागरिकता रद्दको माग गर्दै गृह मन्त्रालयमा उजुरी",5.1,2026-03-05T15:05:09.661848
1,tanahu,तनहुँ,Manjil Rana,मन्‍जिल राना,DDG (en2),Tanahun-1 | Nepal Parliament Election 2082 Results and Updates,https://youthsforum.com/election/district/tanahun/1,View all candidates andelectionresults for TanahunConstituency1inNepalParliamentElection2082.,View all candidates andelectionresults for TanahunConstituency1inNepalParliamentElection2082.,4.8,2026-03-05T15:05:09.661852
1,tanahu,तनहुँ,Manjil Rana,मन्‍जिल राना,Reddit/r/Nepal,"[r/Nepal] Arzu Rana Deuba thinks she’s qualified, has the experience, and can beat any men to become the PM of Nepal.",https://www.reddit.com/r/Nepal/comments/1n981i0/arzu_rana_deuba_thinks_shes_qualified_has_the/,↑89  💬79,"Meanwhile she’s been in parliament 3 times (2008-2017 and 2022 onwards) but never won an election. 

She’s currently in parliament as a proportional representative under Khas Arya quota. Why does such an empowered, strong feminist need a quota?

The only time she ran in election was in 2017, where a man beat her by 5k votes.

 
But she still thinks she has support and popularity within the party to be chose as the PM. 
This just shows how powerful she’s inside the party and as the woman who runs things behind Sher Bahadur. 

During 2022 elections, she said federal grants would withheld from areas not electing Congress candidates.

And let’s not forget the Bhutanese Refugee,  Tikapur land and many other scams she’s linked with.

PS: Sanjay Gupta is the most chatu and lamest podcaster in Nepal. Never seen him press a politicians or ask any tough questions. Brother wants to be close and friendly with every politicians he brings on. Fck him!

Bitch…..
---
She is what she is, but this silwal guy, fuck this kiss ass !
---
Bangurni
---
As a pro feminist I reject you ma'am 
I internalise Misogyny only for you
---
She claimed she was too broke to buy wood for the window in the house she was struggling to build, while her son and daughter in law were busy burning through dirty money on weekly trips abroad. 

One day she was traveling through Putalisadak, saw people dressed well and carrying phones, she told her driver, “Nepal isn’t as poor as people make it seem.”

She rivals KP Oli in corruption and dumbfuckness.",4.5,2026-03-05T15:05:09.661856
1,tanahu,तनहुँ,Manjil Rana,मन्‍जिल राना,Ratopati,मोरङमा दिउँसो २ बजेसम्म ३२ प्रतिशत मत खस्यो,https://www.ratopati.com/story/548241/32-percent-voter-turnout-in-morang-by-2-pm,,"मोरङमा दिउँसो २ बजेसम्म ३२ प्रतिशत मत खस्यो रातोपाटी संवाददाता बिहीबार, २१ फागुन २०८२, १४ : ५४ रातोपाटी संवाददाता बिहीबार, २१ फागुन २०८२ मोरङ । प्रतिनिधि सभा निर्वाचनअन्तर्गत मोरङमा दिउँसो २ बजेसम्म कुल ३२ प्रतिशत मत खसेको छ । जिल्ला प्रशासन कार्यालय मोरङले सार्वजनिक गरेको २ बजेसम्मको विवरण अनुसार, यस अवधिसम्म २ लाख ९२ हजार ४ सय २५ मत खसेको हो । जिल्लाभरिका ८८८ वटा मतदान केन्द्रहरूमा ७ लाख ८३ हजार ४० कुल मतदाता रहेका छन् । मोरङ मतदान खबर पढेर तपाईलाई कस्तो महसुस भयो ? प्रतिक्रिया लेखकको बारेमा रातोपाटी संवाददाता ‘सबैको, सबैभन्दा राम्रो’ रातोपाटी डटकम। लेखकबाट थप भर्खरै रुपन्देहीमा ५० प्रतिशत मत खस्यो रञ्जु दर्शनाले गरिन् मतदान भारत-इङ्ल्यान्ड सेमिफाइनल : मौसम अनुकूल हुँदा वानखेडेमा बन्न सक्छ उच्च स्कोर पर्साको चार वटा निर्वाचन क्षेत्रमा कहाँ कति मत खस्यो ? मोरङमा दिउँसो २ बजेसम्म ३२ प्रतिशत मत खस्यो तनहुँमा किरियापुत्रीद्वारा मतदान ट्रेन्डिङ १. मतदान केन्द्रमा खटिएका कर्मचारी नै पक्राउ परेपछि... २. गन्तव्यमा नपुगी किन फर्कियो बालेन सवार हेलिकप्टर ? ३. बालेन चढेको हेलिकप्टर झापामा ल्यान्ड गरेन, काठमाडौँ फर्कँदै ४. श्रीलंका नजिकै इरानी युद्धपोतमा अमेरिकी आक्रमण, ८० नौसैनिकको मृत्यु ५. बुटवलमा पैसा बाँडेको आरोपमा एमाले र रास्वपाका कार्यकर्ताबिच झडप ६. कर्मचारीमाथि हातपात गर्न खोजेपछि दोलखामा हवाई फायर ७. चुनावमा खटिएका १२ जना सुरक्षाकर्मी र दुई मतदान अधिकृतको मृत्यु ८. राष्ट्रिय सुरक्षा परिषद्को बैठकले के गर्‍याे निर्णय ? छुटाउनुभयो कि ? निर्वाचन बहिष्कार गर्दै आन्दोलनको घोषणा प्रतिनिधि सभा उम्मेदवारले नै पार्टी छाडेपछि... प्रतिनिधि सभा उम्मेदवार पौडेलले फिर्ता लिए उम्मेदवारी रास्वपा र एमालेका कार्यकर्ताबिच झडप, २ जना घाइते धादिङमा बस दुर्घटना: १७ जनाको मृत्यु, २४ घाइते गौर झडप : ३ गाडी र दुई मोटरसाइकलमा आगजनी धादिङ बस दुर्घटनाः मृत्यु भएका १९ मध्ये ९ जनाको सनाखत (नामावलीसहित) बालेनलाई कारबाहीसहित नागरिकता रद्दको माग गर्दै गृह मन्त्रालयमा उजुरी",4.5,2026-03-05T15:05:09.661859
