Constituency,DistrictEnglish,DistrictNepali,CandidateEnglish,CandidateNepali,Source,Title,URL,Snippet,Content,RelevanceScore,ScrapedAt
1,tanahu,तनहुँ,Manjil Rana,मन्‍जिल राना,Reddit/r/Nepal,"[r/Nepal] Nepal Politics: Rabi Lamichhane, Jholeys and to wannabe cool haru",https://www.reddit.com/r/Nepal/comments/1g74svz/nepal_politics_rabi_lamichhane_jholeys_and_to/,↑139  💬87,"**Disclaimer:** If your home, lifestyle, or bank balance is built on corrupt money earned by your father or mother, this post may trigger you. Please feel free to ignore it.

Nepal, a poor, landlocked country, has mostly been ruled by three aging leaders, each heading their own political party. These leaders are backed by loyal followers, or *jholeys*, who would do anything for small rewards like meat and rice, petrol, alcohol, or minor contracts for projects like gravel supplies, road construction, or drainage systems. These *jholeys* believe they have everything because they can call their local leader anytime. On the other hand, there are those from the *panchayat* era who wear traditional attire, like *daurwa suruwal* or proper suits, and receive respectful greetings from the villagers simply because they are the local Congress leaders. These leaders manipulate the middle and lower classes, urging them to vote for Congress or UML.

For over 30 years, these three leaders enjoyed their time in power but would publicly feud during elections, labeling one another as rivals or frauds. However, over time, people grew frustrated with them and started considering voting them out, thinking it was time to replace them with new, energetic leaders. One such rising leader even declared himself as the future prime minister, voicing strong opposition to these three aging leaders.

Then, a new political party was formed, led by a popular journalist with a large fan following. Nepal has seen similar attempts at political revolution before, such as Baburam Bhattarai's *Naya Shakti* and Ujjwal Thapa's *Bibeksheel*, but both failed to secure significant support. Though these movements garnered attention, they didn't receive enough votes. The old political parties were confident that no new party could challenge their dominance, allowing them to continue their corruption unchecked, with no one holding them accountable.

But with the arrival of this new party, which secured 21 seats through both direct and proportional elections, the old leaders were shocked—especially by the amount of support the journalist received. This stirred leaders like Gagan and others to rethink their political future. They began using the media to discredit the journalist, portraying him as the biggest liar and fraud in the country. Even though an official investigation into a cooperative scandal couldn't find any evidence against him, one individual continued to claim he had proof of the journalist’s involvement but failed to substantiate his claims. Gagan found himself in political trouble, with his career at risk as he couldn’t provide any evidence.

Meanwhile, UML and Congress faced their own challenges with the new party, RSP, which presented itself as an alternative democratic force. This was a direct threat to Congress, especially after Rabi, while serving as Home Minister, came close to arresting Arzu Rana Deuba, the wife of the then-prime minister. Bechan Jha, who was linked to Arzu, was arrested, but the government coalition collapsed that same day. Similarly, the son of UML leader Badal Thapa was arrested, and Oli’s personal assistant was on the verge of being detained. These were significant developments, but the media downplayed them to avoid boosting Rabi’s popularity.

In a country where a convicted gangster like *Managey* can become a minister repeatedly, where a convicted murderer like Resham Chaudhary leads a party and holds a position in the current government, where figures involved in the Bhutanese refugee scam, like Baal Kisne Khand, attend Congress meetings, and where a corrupt MP from Congress still sits in parliament—it's ironic that the system is doing everything possible to frame a politician who only entered the political scene two years ago as the biggest conman in Nepal.

I’m not trying to sound ""cool"" by saying, ""I’m not a fan of Rabi,"" or, ""Rabi isn’t a saint either."" If he had compromised, he could’ve had a smooth political career ahead of him. But there’s a reason why all the parties, the media, and intellectuals cry out his name from morning till night. How are people not understanding such a simple truth? It’s as if they’re trying too hard to look ""cool"" and might end up with pneumonia from all the effort. Then there’s another group—those afraid of appearing ignorant or backward—who oppose Rabi just because they believe his supporters are from the Gulf countries, and they want to seem different because they live in Europe, the US, or Australia.

Few other people are thinking this is just Rabi thing and will end with him but this won't. Tomorrow it will be swarnim and then it will be Balen. Remember how media started publishing anything that mukul dhakal used to say , like how swarnim was in contact with India to make Rabi pm of Nepal. That's how they spread propaganda to tarnish image. Tomorrow it will be Balen, cz they don't have to prove anything they just have to spread fake news.

I agree everything you have ",3.9,2026-03-05T15:05:09.661888
1,tanahu,तनहुँ,Manjil Rana,मन्‍जिल राना,Reddit/r/NepalSocial,[r/NepalSocial] NEPAL and Nepalese will have the biggest twist in upcoming Election and guess what? Absolutely kei pani hudaina even though yetro young souls lost their life.,https://www.reddit.com/r/NepalSocial/comments/1nfxyt1/nepal_and_nepalese_will_have_the_biggest_twist_in/,↑3  💬5,"the thing is aba ko election is going to happen based on old constitution. which means tei purano party yemale, maubadi and congress. tei election ma paisa and ghus diyera uniharu le nai jitxan and GEN Z lai loppa khuaidinxan. We are literally fu\*ked and aba xai malai kei hunxa vanney aas pani xaina and aba Nepal kaile pani ramro disha ma janey wala xaina. Sorry to say but our wins feels empty and the huge loss of money and infrastructure will make more inflation and crysis. tesmathi most of the jailed criminals are roaming freely. and weapons on the hands of people jo return nahuna pani sakxa.  
Dubyo Nepal tara tairana ko lagi samundra pani xaina. Sorry guyz it's over now. and sher bahadur, kp oli, arju rana prachanda jasta manxe haru election ma uthxan and we can't do anything about it.

Thanks for making a submission. Please use an appropriate flair for better reach and response. In case of a NSFW post, use ""sax sux"" flair and tag it as NSFW. Otherwise, the post will be removed.

*I am a bot, and this action was performed automatically. Please [contact the moderators of this subreddit](/message/compose/?to=/r/NepalSocial) if you have any questions or concerns.*
---
Ava voter I'd banauna milxa ki nai?
---
Absolutely i support your opinion malai ta lagxa feri 3 tauke mei ek tauke aauxa kina vane we are 5 barsa paxadi ke if this interim government can't ammend the constitution then our main point directly elected prime minister is impossible so if they came this will also not happen. Now army should again come and take over the nation throwing this constitution at any cost. And i was knowing that if the election date is announced then according to constitution we cant add other 18 crossed national then its a direct threat to us many of us like i am 21 also i haven't my voter id so then many of us doesn't have then this sacrifice of our brothers and sister will go khera.
---
Hamle sushila karki choose garekai constitution amendments ko lagi ho.. she knows the law as she was the chief justice of supreme court. Tei karan le second majority vote (26%) discord voting ma Random Nepali dai lai thiyo who is also a lawyer.

So, constitution amendments hunxa related to voting. Chill.",3.9,2026-03-05T15:05:09.661891
1,tanahu,तनहुँ,Manjil Rana,मन्‍जिल राना,DDG (ne1),तनहुँ जिल्ला निर्वाचन परिणाम - तनहुँ District Election Results | Hamro ...,https://election.hamropatro.com/district/40,मन्‍जिलरानाउज्यालो नेपाल पार्टीतनहुँ• गण्डकी प्रदेशनिर्वाचनक्षेत्र 1 पुरुष • 37,मन्‍जिलरानाउज्यालो नेपाल पार्टीतनहुँ• गण्डकी प्रदेशनिर्वाचनक्षेत्र 1 पुरुष • 37,3.6,2026-03-05T15:05:09.661896
1,tanahu,तनहुँ,Manjil Rana,मन्‍जिल राना,DDG (en1),Know Your Candidate Nepal Election 2082 (2026) | नेपाल निर्वाचन २०८२,https://knowyourcandidate.nepabrita.com/,"Know YourCandidateNepalElection2082 BS (2026 AD). Complete verified information about all parliamentarycandidates. Compare, research, and make informed decisions.","Know YourCandidateNepalElection2082 BS (2026 AD). Complete verified information about all parliamentarycandidates. Compare, research, and make informed decisions.",3.6,2026-03-05T15:05:09.661901
1,tanahu,तनहुँ,Manjil Rana,मन्‍जिल राना,Reddit/r/Nepal,[r/Nepal] Nepal’s Monarchists Want a King to Save Them from the Horror of Too Many Rights,https://www.reddit.com/r/Nepal/comments/1j2k4vr/nepals_monarchists_want_a_king_to_save_them_from/,↑112  💬86,"Bring Back the Crown! We’re Tired of This “Freedom” Nonsense  
  
Nepal’s monarchists are back, whining like kids who lost their kite at Dashain, begging for a king to save them from democracy’s wild mess. Too many rights, too many loudmouths—it’s all too much! They want Gyanendra Shah to stumble out of hiding, slap on his crown, and smack away our freedoms so we can go back to the good old days: no opposition, no newspapers, just a king banning shit left and right. Genius move—why fix Nepal’s 2025 madness when you can just outlaw complaining about it? Crown him up, boys, what’s the worst that could happen?  
  
Nepal’s monarchy was never about helping us—it was about keeping us on a leash. The Ranas (1846–1951), those greasy-haired goons, turned Nepal into their own little tyrant playground. Education? Nope—can’t have us reading. Free speech? Nope—shut up or rot in jail. Rights? Ask, and you’d be tied up faster than a goat at a butcher’s. By ’51, only 5% of us could read—perfect, because who needs a revolution when you can’t even write “help”? Then the Shah kings rolled in, giggling, “Let’s ban more!” Mahendra killed parties in ’60, Gyanendra axed democracy in ’05 like he was swatting a fly. These guys banned stuff so hard, they’d have outlawed sunshine if it didn’t kiss their royal asses first.  
  
Gyanendra Shah didn’t even audition for king—he tripped into it after the 2001 royal family massacre turned into a horror show. By 2005, he was done with democracy’s chatter, so he went full dictator mode: dissolved parliament (who needs those clowns?), locked up leaders (too noisy), banned the press (truth’s messy). What’d we get? 1,400 in jail, newspapers gone, and streets full of folks chucking bricks, yelling, “Gyaney chor desh chhod” By ’06, we didn’t just kick him out—in ’08, we burned the whole monarchy down like a bad ex’s love letters. Now, with MPs throwing punches and veggie prices hitting the roof in 2025, some nutjobs want this guy back? Please, you royal bootlickers are dumber than a bag of hammers.  
  
If Nepal resurrects this monarchy crap, what’s Gyanendra banning next? He’s nailed the hits: education (brains breed trouble), free speech (words hurt), elections (kings don’t grovel). In 2025, he’d probably ban WhatsApp leaks of MPs slugging it out, or tax us for breathing Kathmandu’s smog-soup air. Picture it: “Royal Decree: No whining about Melamchi’s ghost pipes—lap up the mud, peasants!” Nepal’s youth are fleeing to Dubai faster than rats off a sinking raft—give ’em a king, and he’ll ban passports, claiming “loyalty’s hotter than remittance cash.” Our laws? Scribbled in royal drool while potholes mock us and jobs vanish. Sign me up—said no sane bastard ever.  
  
  
Here come the Rastriya Prajatantra Party (RPP)—Nepal’s weepy monarchy cheer squad. They’re awful at elections—7 out of 165 seats in ’22, losing worse than a drunk guy betting on buffalo races. With Nepal stuck in 2025’s circus—politicians slugging it out on live TV, prices turning rice into a luxury—they’ve decided democracy’s too tricky. Their big idea? Cry for a king to hand them the win. These losers are so pathetic, they’d crown a stray dog if it barked “Hindu kingdom.” Sorry, boys, Nepal’s too busy dodging coalition flops to care about your royal hard-on.  
  
Kings used to think education was poison—5% literacy meant we were too dumb to riot. Now, monarchists moan that democracy’s a headache: parliament’s a fistfight, tomatoes cost more than your rent, and half the country’s youth are slinging coffee in Dubai. We kicked kings out twice, fought for this hot mess, and won it fair and square. The RPP wants us crawling back because thinking’s hard? That’s not just stupid—it’s a slap to every Nepali who’s ever dodged a falling bridge. They’d ban the news tomorrow if it meant a king, while we’re stuck haggling for onions. Get real, you crown-loving saps.  
  
Monarchy’s dead, and no RPP tears or sappy nostalgia will bring it back. Nepal’s 2025 is a grind—MPs swinging fists, jobs vanishing, air so thick you’d think Kathmandu’s roasting itself—but a king’s as useful as a fart in a fan factory. To the monarchists, royalists, and RPP daydreamers: slap on your big fat L crown and waddle off. We’re done with your sad little fantasy—go cry into your royal fanfic while we dodge traffic and pray for cheaper chiya. Kings don’t fix shit; they just sit on it and stink.

Has there ever been a country in history where Monarchy was restored back after democracy was fully implemented? I don't know what Gyanendra is trying to cause with his constant noise about getting back but even he should know how much of a dangerous game he is playing here. Nepal will be literally torn to shreds and if India is backing him then the our law makers should act now before country goes into full civil war again.
---
Can you imagine in 2025, after two new generations of voting youth since the People's Revolution, someone actually taking RPP seriously? I mean Jesus",3.3,2026-03-05T15:05:09.661905
1,tanahu,तनहुँ,Manjil Rana,मन्‍जिल राना,DDG (ne1),तनहुँ - १ :: Nepal Election 2082 | Baahrakhari Candidate & Results Hub,https://election.baahrakhari.com/kshetra-detail/96,"Get real‑time election insights for Nepal's 2082 General Election. See candidate lists, party details, district breakdowns and key updates in one place.","Get real‑time election insights for Nepal's 2082 General Election. See candidate lists, party details, district breakdowns and key updates in one place.",3.0,2026-03-05T15:05:09.661910
1,tanahu,तनहुँ,Manjil Rana,मन्‍जिल राना,Nepali Times,Who is accountable for teacher-student relationships?,https://www.nepalitimes.com/here-now/who-is-accountable-for-teacher-student-relationships,,"Who is accountable for teacher-student relationships? “I was groomed, then I was sued for defamation,” says university alumna about a faculty member 26 February 2026 Subeksha Poudel 0 As a new student at Kathmandu University's Bachelor’s in Fine Arts in 2014, Mukta, 25 then, thought she must be doing something good when her teacher singled her out for attention. Her teacher was Sujan Chitrakar, then 40, the senior-most faculty, and a celebrated artist. Chitrakar has taught many contemporary Nepali artists and played an important role in establishing what is now KU’s Department of Art and Design (pictured). In between messages to Mukta about schoolwork, he texted to say he missed her or that she looked beautiful. She recalls being taken aback by a particular text that said: ‘I’m going for a bath. Do you want to see me?’ This was immediately followed with a cartoonish drawing with ‘Nude’ written next to it. Mukta awkwardly replied with a laugh, unsure how else to respond to such a message from her teacher, whom everyone placed on a pedestal. During Mukta’s first year in school, she says Chitrakar continued to shower her with gifts, asked her out for coffee, and insisted on driving her around. Once, when she was on his motorcycle returning home from university, Mukta remembers Chitrakar asking her to kiss him on his shoulder. When she refused, he apologised profusely, then asked if she was trying to seduce him. Seeing how shocked Mukta was, the teacher grabbed her hand and rubbed it against his chest, saying it was just a joke. A few weeks later, Chitrakar told Mukta that he couldn’t live without her and that they should be in a relationship. Having only looked up to him as a teacher, Mukta was uncertain about her feelings. When the earthquake struck in 2015, Chitrakar came to check on Mukta, and with her guards down, she felt perhaps his love was genuine. She didn’t doubt if she was safe with him. A decade later, still reeling from psychological trauma and career setbacks because of the relationship, Mukta is breaking her silence, accusing Chitrakar of abusing his power and grooming her. He had the duty of teaching and evaluating her, instead, Mukta says he used her for sex and emotional support from 2015 to 2019, while she was a student at KU. DEFAMATION SUIT She has been urging KU and art institutions to safeguard its students against sexual misconduct, but Chitrakar slammed a defamation lawsuit against her in January 2025 stating she damaged his reputation over what he described in court filings as a ""consensual relationship”. Earlier this week, the Kathmandu District court ruled that Chitrakar’s defamation claim could not be proven. We asked Chitrakar after the verdict about his conduct. His reply: “I’m sorry for the students who felt uncomfortable, but I did my duty well and good. It is ungrateful of the students to say that. Not everyone has to like me.” In answer to a query about his stance on intimate relationship between staff and student, he said: “For me it is a big no to date a student. Consequences arise and I am facing them now. Many staff-student intimate relations, including in my department, have ended in happy marriages. It’s a choice based on their personal and social ethics, and something to be determined by university policy.” Chitrakar said he now draws personal and professional boundaries with students, and says his relationship was not planned. He added, “Regardless of being a teacher I should not have dated a student because I'm a married man. If I was unmarried it would have been ok. While there is no definitive data on sexual misconduct in Nepal, interviews with more than 23 faculty and students from KU and TU for this story reveal that intimate staff-student relations are normalised, and in some cases even encouraged. Studies also suggest that sexual harassment is rampant in higher education in Nepal. The lack of university policies, power imbalance between staff and students, fear of retaliation, breaches of confidentiality, and the protection of perpetrators all contribute to impunity for sexual misconduct. Indeed, after students alleged sexual harassment, bullying, and homophobia against Yubaraj Sangroula of Kathmandu School of Law, and other faculty members in March 2025, the university filed slander lawsuits targeting a student whistleblower and alumni. Sangroula is contesting as an independent candidate in next week’s election from Jhapa-2. Seven years after complaints surfaced against retired lecturer Krishna Bhattachan for sexually harassing women students , Tribhuvan University, the government run institution, is still drafting its own policy and complaint procedure. And noted sculptor and former KU faculty member Gopal Kalapremi is yet to appear at Kathmandu District Court, after he was issued a summon on sexual harassment charges in 2024. Nepal’s Sexual Harassment at Workplace (Prevention) Act (2014) and the National Criminal (Code) Act, 2017 both forbid sexual relations",3.0,2026-03-05T15:05:09.661914
1,tanahu,तनहुँ,Manjil Rana,मन्‍जिल राना,DDG (ne1),Tanahun - 1 Candidates 2082: Official Profiles | तनहुँ - 1 | Nepal ...,https://election2082.erkshitiz.com.np/explore/gandaki/tanahun/tanahun-1,"List of election candidates 2082 in Tanahun - 1. Detailed info on दिपक राज जोशी, प्रेम बहादुर थापा, याम बहादुर आले, रामदत्त जोशी,मन्‍जिलराना, काशीराम गुरुङ, भगवती न्यौपाने, विद्या नाथ ढकाल ...","List of election candidates 2082 in Tanahun - 1. Detailed info on दिपक राज जोशी, प्रेम बहादुर थापा, याम बहादुर आले, रामदत्त जोशी,मन्‍जिलराना, काशीराम गुरुङ, भगवती न्यौपाने, विद्या नाथ ढकाल ...",2.7,2026-03-05T15:05:09.661917
1,tanahu,तनहुँ,Manjil Rana,मन्‍जिल राना,DDG (en1),Nepal's Youth Lead the Charge in the Upcoming Election,https://www.newbusinessage.com/news/47309/nepal-s-youth-lead-the-charge-in-the-upcoming-election/,"This photograph taken on February 3, 2026 showsManjilRana(C), UjyaloNepalPartyelectioncandidateforTanahuconstituency, speaking with his party workers in Kathmandu.","This photograph taken on February 3, 2026 showsManjilRana(C), UjyaloNepalPartyelectioncandidateforTanahuconstituency, speaking with his party workers in Kathmandu.",2.7,2026-03-05T15:05:09.661921
1,tanahu,तनहुँ,Manjil Rana,मन्‍जिल राना,DDG (en1),Nepal's youth lead the charge in the upcoming election - Yahoo,https://www.yahoo.com/news/articles/nepals-youth-lead-charge-upcoming-073934135.html,"""It is very difficult for us to again be fooled by promises from the people who have already been in parliament so many times,"" saidManjilRana, 37, acandidatefor the UjyaloNepalParty inTanahu.","""It is very difficult for us to again be fooled by promises from the people who have already been in parliament so many times,"" saidManjilRana, 37, acandidatefor the UjyaloNepalParty inTanahu.",2.7,2026-03-05T15:05:09.661925
